docid,oldauthor,author,authordate,inferreddate,latestcomp,datetype,startdate,enddate,imprint,imprintdate,contents,genres,subjects,geographics,locnum,oclc,place,recordid,instances,allcopiesofwork,copiesin25yrs,enumcron,volnum,title,parttitle,earlyedition,shorttitle,nonficprob,juvenileprob,first_name,estimated_gender,avg_sentence_count,var_sentence_count,avg_line_count,var_line_count,avg_tokens_per_page,var_tokens_per_page,cap_alpha_freq,genre_tag,lcc_category,full_title,stories_match,tales_match,sketches_match,narratives_match,fables_match,anecdotes_match,legends_match,yarns_match,episodes_match,chronicles_match,recollections_match
mdp.39015033552541,"Bathgate, Janet","Bathgate, Janet",,1894.0,1894.0,s,1894,    ,Selkirk;G. Lewis;1894.,1894,[2d ed.],,Social life and customs,Scotland,,65849110.0,stk,155262,1,1.0,1.0,,,Aunt Janet's legacy to her nieces; | recollections of humble life in Yarrow in the beginning of the century.,,True,Aunt Janet's legacy to her nieces; recollections of humble life in Yarrow in the beginning of the century,0.2871787262855523,0.0881289282485271,Janet,f,11.193236714975846,12.919181311115778,28.17511520737327,69.29652360423879,287.5115207373272,9938.148484784131,0.9,['unknown'],['unknown'],aunt janet's legacy to her nieces; | recollections of humble life in yarrow in the beginning of the century.  aunt janet's legacy to her nieces; recollections of humble life in yarrow in the beginning of the century,False,False,False,False,False,False,False,False,False,False,True
njp.32101063870081,"Marshall, Emma","Marshall, Emma, Mrs",1830-1899.,1894.0,1894.0,s,1894,    ,"London;Seeley and Co., Limited;1894.",1894,,,"1593-1633|Herbert, George",,,16530364.0,enk,9041107,1,1.0,1.0,,,"Under Salisbury spire, in the days of George Herbert; | the recollections of Magdalene Wydville, | $c: by Emma Marshall ...",,True,"Under Salisbury spire, in the days of George Herbert; the recollections of Magdalene Wydville",0.2705480251011869,0.4092612391919092,Emma,f,13.113960113960117,32.27761138302449,29.070821529745043,20.47373785200105,295.61756373937675,3184.7120994470706,3.7,['fiction'],['unknown'],"under salisbury spire, in the days of george herbert; | the recollections of magdalene wydville, | $c: by emma marshall ...  under salisbury spire, in the days of george herbert; the recollections of magdalene wydville",False,False,False,False,False,False,False,False,False,False,True
ncs1.ark+=13960=t03x8kf5b,"Custance, Henry","Custance, Henry",,1894.0,1894.0,s,1894,    ,London;Edward Arnold;1894.,1894,,,Horse racing|Great Britain,,,19961291.0,enk,10668962,1,1.0,1.0,1894,,Riding recollections and turf stories,,True,Riding recollections and turf stories,0.8791884728095015,0.7438278973255446,Henry,m,10.157232704402515,12.358925675408408,29.175925925925927,37.558556241426615,260.50308641975306,3965.2993731900624,1.7,['unknown'],['unknown'],riding recollections and turf stories  riding recollections and turf stories,True,False,False,False,False,False,False,False,False,False,True
njp.32101064794264,"Walbran, Francis M","Walbran, Francis M",,1895.0,1895.0,s,1895,    ,"Scarborough [Eng.;""The Angler"" Co., Ltd.;1895.",1895,,,Grayling fishing,,,19037708.0,enk,8921810,1,1.0,1.0,,,"Grayling and how to catch them, | and recollections of a sportsman.",,True,"Grayling and how to catch them, and recollections of a sportsman",0.9669012736283727,0.8472781494548315,Francis,m,9.846666666666666,25.07648888888889,24.529411764705884,69.6478277585544,252.88888888888889,8781.523602033405,1.9,['unknown'],['unknown'],"grayling and how to catch them, | and recollections of a sportsman.  grayling and how to catch them, and recollections of a sportsman",False,False,False,False,False,False,False,False,False,False,True
uc1.b3039194,"Whyte-Melville, G. J. (George John)","Whyte-Melville, G. J. (George John)",1821-1878.,1898.0,1878.0,m,1898,1902,"London;W. Thacker;Calcutta;Thacker, Spink;1898-1902.",1898-1902,[v.1] Cerise.--[v.2] General Bounce.--[v.3] Good for nothing.--[v.4] Holmby house.--[v.5] The interpreter.--[v.6] Kate Coventry.--[v.7] Riding recollections.--[v.8] Sarachedon.--[v.9] Sister Louise. Rosine.,,,,,3967109.0,enk,7313579,1,1.0,1.0,v.7,7.0,The works of G.J. Whyte-Melville / | $c: edited by Sir Herbert Maxwell.,Riding recollections,True,Riding recollections,0.4913605007532232,0.0070833714957109,George,m,9.479418886198546,16.69509699886849,33.0354609929078,68.92309239977868,350.5744680851064,9047.407575071677,1.4,['unknown'],['unknown'],the works of g.j. whyte-melville / | $c: edited by sir herbert maxwell. riding recollections riding recollections,False,False,False,False,False,False,False,False,False,False,True
uc2.ark+=13960=t8hd7rf9q,"Ganthony, Robert","Ganthony, Robert",,1899.0,1899.0,s,1899,    ,London;H. J. Drane;1899,1899,,,"Ganthony, Robert",,CT788.G25A3,26532609.0,enk,1692573,2,2.0,2.0,,,Random recollections,,True,Random recollections,0.7493959315016904,0.2177784988152167,Robert,m,12.930769230769233,22.749053254437868,40.12452830188679,65.60336062655749,335.25283018867924,7594.151171235315,2.6,['unknown'],['unknown'],random recollections  random recollections,False,False,False,False,False,False,False,False,False,False,True
uc2.ark+=13960=t77s7m05b,"Cardigan and Lancastre, Adeline Louis Maria de Horsey","Cardigan and Lancastre, Adeline Louis Maria de Horsey",,1909.0,1909.0,s,1909,    ,London;E. Nash;1909.,1909,,,Court and courtiers|Great Britain,,DA565.C3A3,1209177.0,enk,5798091,2,2.0,2.0,,,My recollections,,True,My recollections,0.5957147478897421,0.2198798515631432,Adeline,f,6.626262626262626,7.708805223956738,25.25242718446602,62.615892167028,173.56796116504853,3910.022080309172,2.0,['unknown'],['great britain'],my recollections  my recollections,False,False,False,False,False,False,False,False,False,False,True
uc2.ark+=13960=t3fx7fk0m,"Faber, M. A","Faber, M. A",,1910.0,1910.0,s,1910,    ,London;Chiswick Press;1910.,1910,,,Description and travel|India,,,13319510.0,enk,7698528,1,1.0,1.0,,,Recollections of Indian life,,True,Recollections of Indian life,0.981344931291268,0.978015688061019,M,unknown,11.824324324324325,7.33400292184076,34.27160493827161,119.5311690291114,285.962962962963,8955.739368998627,2.7,['unknown'],['unknown'],recollections of indian life  recollections of indian life,False,False,False,False,False,False,False,False,False,False,True
uc2.ark+=13960=t4vh5hq9p,L??onard,L??onard,,1912.0,1912.0,s,1912,    ,"London;Greening and Co., Ltd.;1912.",1912,,,"France|1755-1793|Queen, consort of Louis XVI, King of France|Marie Antoinette|Court and courtiers",,,18692899.0,enk,6546773,1,1.0,1.0,,,"Recollections of L??onard, hairdresser to Queen Marie-Antoinette",,True,"Recollections of L??onard, hairdresser to Queen Marie-Antoinette",0.5329882587819758,0.1564688312514478,Lonard,unknown,8.152439024390244,10.20846966091612,30.05044510385757,47.074606626808375,221.1810089020772,2921.281775836716,2.8,['unknown'],['unknown'],"recollections of l??onard, hairdresser to queen marie-antoinette  recollections of l??onard, hairdresser to queen marie-antoinette",False,False,False,False,False,False,False,False,False,False,True
