docid,oldauthor,author,authordate,inferreddate,latestcomp,datetype,startdate,enddate,imprint,imprintdate,contents,genres,subjects,geographics,locnum,oclc,place,recordid,instances,allcopiesofwork,copiesin25yrs,enumcron,volnum,title,parttitle,earlyedition,shorttitle,nonficprob,juvenileprob,first_name,estimated_gender,avg_sentence_count,var_sentence_count,avg_line_count,var_line_count,avg_tokens_per_page,var_tokens_per_page,cap_alpha_freq,genre_tag,lcc_category,full_title,stories_match,tales_match,sketches_match,narratives_match,fables_match,anecdotes_match,legends_match,yarns_match,episodes_match,chronicles_match,recollections_match
njp.32101067646065,"Holland, John","Holland, John",1794-1872.,1824.0,1824.0,s,1824,    ,London;H. Fisher;1824.,1824,,,,,,5809304.0,enk,8961969,1,1.0,1.0,,,"The old arm-chair : | or, Recollections of a bachelor : a tale / | $c: by Sexagenarius [i.e. J. Holland].",,True,"The old arm-chair : or, Recollections of a bachelor : a tale",0.6943531428240867,0.2009320462869109,John,m,5.630662020905923,9.61271837705933,24.81660899653979,19.194741442272004,195.46712802768167,2091.688365800218,1.5,['fiction'],['unknown'],"the old arm-chair : | or, recollections of a bachelor : a tale / | $c: by sexagenarius [i.e. j. holland].  the old arm-chair : or, recollections of a bachelor : a tale",False,False,False,False,False,False,False,False,False,False,True
nyp.33433074957402,"O'Sullivan, Samuel","O'Sullivan, Samuel",,1825.0,1825.0, ,1825,    ,"London;Longman, Hurst, Rees, Orme, Brown, and Green;1825.",1825,,,Ireland|College students,,,23936361.0,enk,7656087,2,2.0,2.0,,,College recollections..,,True,College recollections,0.1072732878622709,0.0161277471355558,Samuel,m,7.232638888888889,6.991018036265432,25.06529209621993,19.359998110556088,238.2508591065292,2449.5831178186377,1.6,['unknown'],['unknown'],college recollections..  college recollections,False,False,False,False,False,False,False,False,False,False,True
uc1.b3321448,"Boswell, Thomas Alexander","Boswell, Thomas Alexander",,1826.0,1826.0,s,1826,    ,London;Saunders and Otley;1826.,1826,,,,,,2132737.0,enk,7914959,2,2.0,2.0,v. 1,1.0,"Recollections of a pedestrian. | $c: By the author of ""The journal of an exile ... """,,True,Recollections of a pedestrian,0.3242367804557161,0.4399641355404605,Thomas,m,6.479310344827586,6.408192627824019,19.928571428571427,14.447278911564627,179.4387755102041,1495.9333263917813,1.3,['fiction'],['unknown'],"recollections of a pedestrian. | $c: by the author of ""the journal of an exile ... ""  recollections of a pedestrian",False,False,False,False,False,False,False,False,False,False,True
mdp.39015073732433,"Hunt, Leigh","Hunt, Leigh",1784-1859.,1828.0,1828.0,s,1828,    ,London;H. Colburn;1828.,1828,2d ed. ...,,"Description and travel|1792-1822|Shelley, Percy Bysshe|Byron, George Gordon Byron|Baron|Correspondence|1788-1824|Authors",Italy,PR4381.H7 1828,2610667.0,enk,588507,1,1.0,1.0,v.2,2.0,"Lord Byron and some of his contemporaries; | with Recollections of the author's life, and of his visit to Italy. | $c: By Leigh Hunt.",,True,"Lord Byron and some of his contemporaries; with Recollections of the author's life, and of his visit to Italy",0.9023104700173696,0.3352107348718648,Leigh,f,10.562091503267974,68.73851937289078,25.43776824034335,32.13453922525742,240.3540772532189,3615.6278481828726,2.7,['unknown'],['english literature'],"lord byron and some of his contemporaries; | with recollections of the author's life, and of his visit to italy. | $c: by leigh hunt.  lord byron and some of his contemporaries; with recollections of the author's life, and of his visit to italy",False,False,False,False,False,False,False,False,False,False,True
nyp.33433081598363,"Carne, John","Carne, John",1789-1844.,1830.0,1830.0,s,1830,    ,London;H. Colburn and R. Bentley;1830.,1830,,,Description and travel,Middle East,,18361195.0,enk,1862584,2,2.0,2.0,,,Recollections of travels in the East; | forming a continuation of the Letters from the East.,,True,Recollections of travels in the East; forming a continuation of the Letters from the East,0.8181061868226317,0.007166342109762,John,m,6.511299435028248,17.967386447061827,23.05292479108635,15.849566654510753,208.1030640668524,1723.2623582995166,1.5,['unknown'],['unknown'],recollections of travels in the east; | forming a continuation of the letters from the east.  recollections of travels in the east; forming a continuation of the letters from the east,False,False,False,False,False,False,False,False,False,False,True
hvd.hwcl76,"Angelo, Henry","Angelo, Henry",1756-1835.,1834.0,1834.0,s,1834,    ,London;J. Ebers;1834.,1834,,,Table-talk,,PN6251.A5,1243906.0,enk,9717467,2,2.0,2.0,,,"Angelo's pic nic, or, Table talk : | including numerous recollections of public characters, who have figured in some part or another of the stage of life for the last fifty years : forming an endless variety of talent, amusement, and interest, calculated to please every person fond of biographical sketches and anecdotes / | $c: written by himself ; in addition to which are several original literary contributions from the following distinguished authors: Colman ... [et al.]",,True,"Angelo's pic nic, or, Table talk : including numerous recollections of public characters, who have figured in some part or another of the stage of life for the last fifty years : forming an endless variety of talent, amusement, and interest, calculated to please every person fond of biographical sketches and anecdotes",0.600536256947922,0.1444806612643091,Henry,m,8.521091811414392,15.113078708692251,23.926470588235293,9.587730680507496,229.8063725490196,1634.9208417435602,8.0,['unknown'],['literature (general)'],"angelo's pic nic, or, table talk : | including numerous recollections of public characters, who have figured in some part or another of the stage of life for the last fifty years : forming an endless variety of talent, amusement, and interest, calculated to please every person fond of biographical sketches and anecdotes / | $c: written by himself ; in addition to which are several original literary contributions from the following distinguished authors: colman ... [et al.]  angelo's pic nic, or, table talk : including numerous recollections of public characters, who have figured in some part or another of the stage of life for the last fifty years : forming an endless variety of talent, amusement, and interest, calculated to please every person fond of biographical sketches and anecdotes",False,False,True,False,False,True,False,False,False,False,True
mdp.39015006978483,"Ellis, Sarah Stickney","Ellis, Sarah Stickney",1812-1872.,1842.0,1842.0,s,1842,    ,"London [etc.;Fisher, son & co.;1842",1842,v.1. Dangers of dining out. Confessions of a maniac. Somerville hall. The rising tide. The favourite child.--v.2. First impressions. The minister's family.--v.3. The young sculptor. The two friends. Fireside recollections.,,,,PZ3.E476F,1693132.0,enk,782309,2,2.0,2.0,v.3,3.0,"Family secrets, or, Hints to those who would make home happy / | $c: By the author of ""The women of England"" ...",The young sculptor. The two friends. Fireside recollections,True,The young sculptor. The two friends. Fireside recollections,0.1708879058105704,0.00360747890088,Sarah,f,9.025316455696204,14.303156545425416,30.694864048338367,51.19692226248391,324.9969788519638,8359.49545915061,0.6,['unknown'],['fiction and juvenile belles lettres'],"family secrets, or, hints to those who would make home happy / | $c: by the author of ""the women of england"" ... the young sculptor. the two friends. fireside recollections the young sculptor. the two friends. fireside recollections",False,False,False,False,False,False,False,False,False,False,True
nyp.33433082342159,"Campbell, Calder","Campbell, Calder",,1847.0,1847.0,s,1847,    ,London;1847.,1847,,,,,,34529332.0,enk,8638159,1,1.0,1.0,v. 1,1.0,Rough Recollections of Rambles Abroàd and at Home.,,True,Rough Recollections of Rambles Abroàd and at Home,0.441781622143486,0.2254707571741654,Calder,m,5.301324503311259,4.356223411253892,19.324590163934428,11.471690405804893,161.3409836065574,1011.0902875571084,1.4,['unknown'],['unknown'],rough recollections of rambles abroàd and at home.  rough recollections of rambles abroàd and at home,False,False,False,False,False,False,False,False,False,False,True
nyp.33433074920244,"Neale, Erskine","Neale, Erskine",1804-1883.,1849.0,1849.0,s,1849,    ,London;R. Bentley;1849.,1849,"New ed.,|with new preface and additions.",,,,,36386155.0,enk,8667104,1,1.0,1.0,,,"Experiences of a gaol chaplain; | comprising recollections of ministerial intercourse with criminals of various classes, with their confessions.",,True,"Experiences of a gaol chaplain; comprising recollections of ministerial intercourse with criminals of various classes, with their confessions",0.2086992670751229,0.0151277334340925,Erskine,m,24.350467289719628,41.12483623023845,39.49653579676674,29.395484535092724,450.270207852194,5333.185648224696,1.9,['fiction'],['unknown'],"experiences of a gaol chaplain; | comprising recollections of ministerial intercourse with criminals of various classes, with their confessions.  experiences of a gaol chaplain; comprising recollections of ministerial intercourse with criminals of various classes, with their confessions",False,False,False,False,False,False,False,False,False,False,True
mdp.39015030741618,"Patmore, P. G. (Peter George)","Patmore, P. G. (Peter George)",1786-1855.,1854.0,1854.0,s,1854,    ,London;Saunders and Otley;1854.,1854,v. 1. Charles Lamb. Thomas Campbell. The Countess of Blessington. R. Plumer Ward. - v. 2. R. Plumer Ward (cont.) Horace and James Smith. William Hazlitt. - v. 3. William Hazlitt (cont.) Laman Blanchard. Richard Brinsley Sheridan and Thomas Sheridan.,,"Authors, English",,PR452.P3,1179029.0,enk,160912,1,1.0,1.0,v.1,1.0,"My friends and acquaintance: | being memorials, mind-portraits, and personal recollections of deceased celebrities of the nineteenth century: with selections from their unpublished letters. | $c: By P. G. Patmore.",Charles Lamb. Thomas Campbell. The Countess of Blessington. R. Plumer Ward,True,Charles Lamb. Thomas Campbell. The Countess of Blessington. R. Plumer Ward,0.7013748790484607,0.0020097681753214,Peter,m,6.052631578947368,10.964335180055402,23.937694704049843,38.35748876660747,200.8816199376947,3704.2788210518142,0.9,['unknown'],['english literature'],"my friends and acquaintance: | being memorials, mind-portraits, and personal recollections of deceased celebrities of the nineteenth century: with selections from their unpublished letters. | $c: by p. g. patmore. charles lamb. thomas campbell. the countess of blessington. r. plumer ward charles lamb. thomas campbell. the countess of blessington. r. plumer ward",False,False,False,False,False,False,False,False,False,False,True
mdp.39015030741592,"Patmore, P. G. (Peter George)","Patmore, P. G. (Peter George)",1786-1855.,1854.0,1854.0,s,1854,    ,London;Saunders and Otley;1854.,1854,v. 1. Charles Lamb. Thomas Campbell. The Countess of Blessington. R. Plumer Ward. - v. 2. R. Plumer Ward (cont.) Horace and James Smith. William Hazlitt. - v. 3. William Hazlitt (cont.) Laman Blanchard. Richard Brinsley Sheridan and Thomas Sheridan.,,"Authors, English",,PR452.P3,1179029.0,enk,160912,1,1.0,1.0,v.2,2.0,"My friends and acquaintance: | being memorials, mind-portraits, and personal recollections of deceased celebrities of the nineteenth century: with selections from their unpublished letters. | $c: By P. G. Patmore.",R. Plumer Ward (cont.) Horace and James Smith. William Hazlitt,True,R. Plumer Ward (cont.) Horace and James Smith. William Hazlitt,0.6438136524564205,0.0306342969397176,Peter,m,6.932960893854749,14.174276707967916,24.476712328767125,21.071375492587727,211.81917808219177,2308.487851379246,1.9,['unknown'],['english literature'],"my friends and acquaintance: | being memorials, mind-portraits, and personal recollections of deceased celebrities of the nineteenth century: with selections from their unpublished letters. | $c: by p. g. patmore. r. plumer ward (cont.) horace and james smith. william hazlitt r. plumer ward (cont.) horace and james smith. william hazlitt",False,False,False,False,False,False,False,False,False,False,True
mdp.39015030741600,"Patmore, P. G. (Peter George)","Patmore, P. G. (Peter George)",1786-1855.,1854.0,1854.0,s,1854,    ,London;Saunders and Otley;1854.,1854,v. 1. Charles Lamb. Thomas Campbell. The Countess of Blessington. R. Plumer Ward. - v. 2. R. Plumer Ward (cont.) Horace and James Smith. William Hazlitt. - v. 3. William Hazlitt (cont.) Laman Blanchard. Richard Brinsley Sheridan and Thomas Sheridan.,,"Authors, English",,PR452.P3,1179029.0,enk,160912,1,1.0,1.0,v.3,3.0,"My friends and acquaintance: | being memorials, mind-portraits, and personal recollections of deceased celebrities of the nineteenth century: with selections from their unpublished letters. | $c: By P. G. Patmore.",William Hazlitt (cont.) Laman Blanchard. Richard Brinsley Sheridan and Thomas Sheridan,True,William Hazlitt (cont.) Laman Blanchard. Richard Brinsley Sheridan and Thomas Sheridan,0.5427906140185785,0.0021715191147896,Peter,m,7.362573099415204,28.611230806059982,24.242857142857144,28.926734693877552,204.60285714285715,2500.633706122449,1.9,['unknown'],['english literature'],"my friends and acquaintance: | being memorials, mind-portraits, and personal recollections of deceased celebrities of the nineteenth century: with selections from their unpublished letters. | $c: by p. g. patmore. william hazlitt (cont.) laman blanchard. richard brinsley sheridan and thomas sheridan william hazlitt (cont.) laman blanchard. richard brinsley sheridan and thomas sheridan",False,False,False,False,False,False,False,False,False,False,True
mdp.39015013716066,"Mrs., Thomson, A. T","Thomson, A. T, Mrs",1797-1862.,1854.0,1854.0,s,1854,    ,London;R. Bentley;1854.,1854,"v. 1. Dr. Maginn. Ham House, and its inhabitants. Hampton court, past and present. Holland house and its inhabitants. Mrs. Montagu, and her friends. Whitehall and its predecessors - the palace of Westminster - York house. The ancient palace of Greenwich (Placentia) and the days of the Tudors. Kenilworth, its heroes and its heroines. The siege of Ragland castle, and the Somerset family.--v. 2. Basing house: its beseigers and beseiged. Latham house and the Stanley family. Coleridge; Sir James Hal",,"Authors, English",,PR453.T5,604783.0,enk,204636,1,1.0,1.0,v.2,2.0,Recollections of literary characters and celebrated places. | $c: By Mrs. Thomson.,Basing house: its beseigers and beseiged. Latham house and the Stanley family. Coleridge; Sir James Hal,True,Basing house: its beseigers and beseiged. Latham house and the Stanley family. Coleridge; Sir James Hal,0.5065316049499518,0.0032036720047552,A,unknown,13.817901234567902,208.4946178174059,30.024242424242424,118.18123048668504,309.5212121212121,6805.952580348944,2.1,['unknown'],['english literature'],recollections of literary characters and celebrated places. | $c: by mrs. thomson. basing house: its beseigers and beseiged. latham house and the stanley family. coleridge; sir james hal basing house: its beseigers and beseiged. latham house and the stanley family. coleridge; sir james hal,False,False,False,False,False,False,False,False,False,False,True
nyp.33433074932124,"Mrs., Thomson, A. T","Thomson, A. T, Mrs",1797-1862.,1854.0,1854.0,s,1854,    ,London;R. Bentley;1854.,1854,"v. 1 Dr. Maginn. Ham house, and its inhabitants. Hampton court, past and present. Holland house and its inhabitants. Mrs. Montagu, and her friends. Whitehall and its predecessors--the palace of Westminster--York house. The ancient palace of Greenwich (Placentia) ...",,,,,19893244.0,enk,5794420,1,1.0,1.0,v. 2,2.0,Recollections of literary characters and celebrated places. | $c: By Mrs. Thomson ...,,True,Recollections of literary characters and celebrated places,0.481601557240762,0.0025091366606753,A,unknown,12.006666666666666,116.1266222222222,29.45394736842105,91.45840547091414,306.57236842105266,4815.0210786011085,2.3,['unknown'],['unknown'],recollections of literary characters and celebrated places. | $c: by mrs. thomson ...  recollections of literary characters and celebrated places,False,False,False,False,False,False,False,False,False,False,True
uc2.ark+=13960=t3nv9fr8n,"Curling, Henry","Curling, Henry",1803-1864.,1855.0,1855.0,s,1855,    ,London;T. Bosworth;1855.,1855,,,Anecdotes|Theater,,PS4525.C25R4,5329420.0,enk,1023515,1,1.0,1.0,,,Recollections of the mess-table and the stage,,True,Recollections of the mess-table and the stage,0.4495697967334696,0.1281760748498548,Henry,m,11.449814126394052,58.03186799519078,33.89377289377289,35.14988796307478,273.5860805860806,3585.612553502663,2.5,['unknown'],['unknown'],recollections of the mess-table and the stage  recollections of the mess-table and the stage,False,False,False,False,False,False,False,False,False,False,True
mdp.39015058691315,,,,1858.0,1858.0,m,1858,1880,Edinburgh;London;W. Blackwood and sons;1858-1880,1858-1880,"joint-stock company (limited). Walford, L.B. Bee or Beatrix. The night-wanderer of an Afghaun fort. Macleod, N. Ayrshire curling song. Hamley, C. The light on the hearth. How to boil peas. Keene, H.G. Clive's dream before the battle of Plassey.--v.6. Lever, C. What I did at Belgrade. Shand, A.I. Wrecked off the Riff coast. Dollie, and the two Smiths. Majendie, Margaret, lady. A railway journey. Francillon, R.E. A dog without a tail. Hamley, C. Wassail.|v.1. The tender recollections of Irene Mac",,,,PZ1.B57A,37193215.0,stk,203870,1,1.0,1.0,v.6,6.0,"Tales from ""Blackwood."" | New series.",The tender recollections of Irene Mac,True,The tender recollections of Irene Mac,0.2150619775737624,0.028170631449255,,unknown,11.94535519125683,15.696467496789989,27.9142091152815,20.70577665332173,278.1340482573726,3089.864068598208,1.4,['fiction'],['fiction and juvenile belles lettres'],"tales from ""blackwood."" | new series. the tender recollections of irene mac the tender recollections of irene mac",False,True,False,False,False,False,False,False,False,False,True
wu.89075295477,"Taffetas, Hester","Taffetas, Hester",,1858.0,1858.0,s,1858,    ,London;Knight;1858,1858,2nd ed.,,"Great Britain|Millinery workers|England|History|George III, 1760-1820|Royal households",Great Britain,,37345130.0,enk,5820777,1,1.0,1.0,,,Recollections of Mrs. Hester Taffetas : | court milliner and modiste during the reign of King George the Third and his consort Queen Charlotte / | $c: edited by her granddaughter.,,True,Recollections of Mrs. Hester Taffetas : court milliner and modiste during the reign of King George the Third and his consort Queen Charlotte,0.1300397519514894,0.0426599352703133,Hester,f,10.227180527383368,15.603561421770918,30.89516129032258,34.56158949011447,287.8165322580645,3920.786904103798,1.4,['unknown'],['unknown'],recollections of mrs. hester taffetas : | court milliner and modiste during the reign of king george the third and his consort queen charlotte / | $c: edited by her granddaughter.  recollections of mrs. hester taffetas : court milliner and modiste during the reign of king george the third and his consort queen charlotte,False,False,False,False,False,False,False,False,False,False,True
njp.32101073397513,,,,1858.0,1858.0,s,1858,    ,London;Knight;1858,1858,,,,,,13272984.0,enk,9015075,1,1.0,1.0,,,"Recollections of Mrs. Hester Taffetas, court milliner and modiste during the reign of King George the Third and his consort Queen Charlotte. | $c: Edited by her grandaughter.",,True,"Recollections of Mrs. Hester Taffetas, court milliner and modiste during the reign of King George the Third and his consort Queen Charlotte",0.10385868743508,0.0156994890634435,,unknown,10.590759075907592,20.14275288915029,28.06514657980456,36.77100022281404,263.5732899022801,4350.817918492504,1.4,['unknown'],['unknown'],"recollections of mrs. hester taffetas, court milliner and modiste during the reign of king george the third and his consort queen charlotte. | $c: edited by her grandaughter.  recollections of mrs. hester taffetas, court milliner and modiste during the reign of king george the third and his consort queen charlotte",False,False,False,False,False,False,False,False,False,False,True
uc1.b3370385,"Berkeley, Grantley F. (Grantley Fitzhardinge)","Berkeley, Grantley F. (Grantley Fitzhardinge)",1800-1881.,1865.0,1865.0,m,1865,1866,London;Hurst and Blackett;1865-66.,1865-1866,,,,,,,enk,10054547,1,2.0,2.0,v.1,1.0,My life and recollections.,,True,My life and recollections,0.5794917692839805,0.0734103832178186,Grantley,unknown,9.926208651399492,9.589974684199964,31.808564231738035,26.376450583405777,310.87405541561714,3166.875825619095,1.7,['unknown'],['unknown'],my life and recollections.  my life and recollections,False,False,False,False,False,False,False,False,False,False,True
uc2.ark+=13960=t9t14wd92,"Hemyng, Bracebridge","Hemyng, Bracebridge",1841-1901.,1870.0,1870.0,s,1870,    ,"London;Ward, Lock, and Tyler;1870?",1870,,,,,,11106549.0,enk,7662049,1,1.0,1.0,,,"Eton school days, or, Recollections of an Etonian",,True,"Eton school days, or, Recollections of an Etonian",0.3046221952315514,0.2673583739414152,Bracebridge,unknown,13.349056603773583,20.271241248368344,31.773993808049536,43.01084070584401,254.625386996904,2867.8070335189645,4.0,['fiction'],['unknown'],"eton school days, or, recollections of an etonian  eton school days, or, recollections of an etonian",False,False,False,False,False,False,False,False,False,False,True
nyp.33433008440715,"Boteler, John Harvey","Boteler, John Harvey",,1883.0,1883.0,s,1883,    ,London;Diprose and Bateman;1883.,1883,,,Great Britain|1808-30|History|Royal Navy,,,38479585.0,enk,8592489,1,1.0,1.0,,,Recollections of my sea life ... from 1808 to 1830.,,True,Recollections of my sea life ... from 1808 to 1830,0.8957930223053616,0.118882137283432,John,m,18.291666666666668,22.911142676767675,39.14393939393939,19.403523875114782,537.4128787878788,4329.522712924701,3.1,['unknown'],['unknown'],recollections of my sea life ... from 1808 to 1830.  recollections of my sea life ... from 1808 to 1830,False,False,False,False,False,False,False,False,False,False,True
mdp.39015063947926,"Payn, James","Payn, James",1830-1898.,1884.0,1884.0,s,1884,    ,"London;Smith, Elder, & co.;1884.",1884,,,"Correspondence, reminiscences, etc|Authors, English",,,485332.0,enk,246880,1,2.0,2.0,,,Some literary recollections.,,True,Some literary recollections,0.8128063534825746,0.0028743263086996,James,m,9.453237410071942,9.26939599399617,26.07801418439716,17.355615914692418,252.4184397163121,2227.044766359841,2.7,['unknown'],['unknown'],some literary recollections.  some literary recollections,False,False,False,False,False,False,False,False,False,False,True
uc2.ark+=13960=t0js9zf5x,"Service, John","Service, John",,1887.0,1887.0,s,1887,    ,Edinburgh;Y. J. Pentland;1887.,1887,,,,,,6404111.0,stk,7703334,1,1.0,1.0,,,The life and recollections of Doctor Duguid of Kilwinning,,True,The life and recollections of Doctor Duguid of Kilwinning,0.1248996935393652,0.0049175887091941,John,m,8.353535353535353,17.380063258851138,27.960264900662253,84.938818472874,211.0,5408.390728476821,2.2,['fiction'],['unknown'],the life and recollections of doctor duguid of kilwinning  the life and recollections of doctor duguid of kilwinning,False,False,False,False,False,False,False,False,False,False,True
mdp.39015064796819,,,,1891.0,1857.0,r,1891,1857,York;Printed for the author's friends;1857.,1857,,,Flagellation,,PR4099.B95M4 1891 (Rare Bk Coll),39053814.0,enk,1693788,1,1.0,1.0,,,"The merry order of St. Bridget; | personal recollections of the use of the rod, | $c: by Margaret Anson.",,False,The merry order of St. Bridget; personal recollections of the use of the rod,0.1036689395376131,0.1582229773277696,,unknown,9.030172413793103,5.830986177170035,20.948936170212765,15.384626527840652,220.18297872340423,2638.0814124038025,1.9,['unknown'],['english literature'],"the merry order of st. bridget; | personal recollections of the use of the rod, | $c: by margaret anson.  the merry order of st. bridget; personal recollections of the use of the rod",False,False,False,False,False,False,False,False,False,False,True
yale.39002030860077,"North, Marianne","North, Marianne",1830-1890.,1892.0,1890.0,s,1892,    ,London;New York;Macmillan;1892.,1892,2d ed.,,"1830-1890|North, Marianne|Voyages and travels",,,2610533.0,enk,8732174,1,3.333333333333333,3.333333333333333,v.1,1.0,"Recollections of a happy life : | being the autobiography of Marianne North / | $c: edited by her sister, Mrs. John Addington Symonds.",,True,Recollections of a happy life : being the autobiography of Marianne North,0.9653012498814536,0.202649113654936,Marianne,f,13.112947658402204,11.620851641888455,34.260162601626014,39.67757287328971,401.0,7918.20054200542,1.7,['unknown'],['unknown'],"recollections of a happy life : | being the autobiography of marianne north / | $c: edited by her sister, mrs. john addington symonds.  recollections of a happy life : being the autobiography of marianne north",False,False,False,False,False,False,False,False,False,False,True
uc1.$b80603,"Legouv??, Ernest","Legouvé, Ernest",,1893.0,1893.0,s,1893,    ,"London;Sydney;Eden, Remington & Co.;1893.",1893,,,,,,9814356.0,enk,6589405,1,3.0,3.0,v.1,1.0,Sixty years of recollections,,True,Sixty years of recollections,0.5099675693640967,0.0187996295056552,Ernest,m,13.804804804804805,43.56249943637332,28.194690265486727,19.69070926984624,289.6371681415929,3055.411125903881,2.3,['unknown'],['unknown'],sixty years of recollections  sixty years of recollections,False,False,False,False,False,False,False,False,False,False,True
