docid,oldauthor,author,authordate,inferreddate,latestcomp,datetype,startdate,enddate,imprint,imprintdate,contents,genres,subjects,geographics,locnum,oclc,place,recordid,instances,allcopiesofwork,copiesin25yrs,enumcron,volnum,title,parttitle,earlyedition,shorttitle,nonficprob,juvenileprob,first_name,estimated_gender,avg_sentence_count,var_sentence_count,avg_line_count,var_line_count,avg_tokens_per_page,var_tokens_per_page,cap_alpha_freq,genre_tag,lcc_category,full_title,stories_match,tales_match
mdp.39015030126547,"Roscoe, Thomas","Roscoe, Thomas",1791-1871.,1826.0,1826.0,s,1826,    ,London;H. Colburn;1826.,1826,"v. 1. Introduction. Reineke Fuchs (Reynard the Fox) numerous authors and editions of it. The pleasant history of Reynard the Fox Flowleglass, the merry jester. Doctor Faustus. v. 2. Popular traditions collected and narrated by the Ormar i. e. I. K. C. Nachtigal, [2] K. L. Gottschalek: [3] P. Eberhardt: [4] J. G. G. Busching: [5] I. L. K. and W. K. Grimm; [6] Lothar u. c. O. C. von Graevem. (The arch rogue, Castle Christburg); [7] F. H. K. freiherr de La Motte-Foueué. (the field",,"English fiction|German fiction|Folk literature, German|Translations from German|Translations into English|Legends, German",,,2679477.0,enk,1777574,1,2.0,2.0,v.4,4.0,The German novelists: | tales selected from ancient and modern authors in that language: from the earliest period down to the close of the eighteenth century. Tr. from the originals: with critical and biographical notices. | $c: By Thomas Roscoe ...,J. G. G. Busching:,True,J. G. G. Busching:,0.0809736118306652,0.0440778309825925,Thomas,m,9.933510638297872,9.73760044137619,25.20680628272252,23.54100079493435,258.92931937172773,2751.379821002714,1.5,['unknown'],['unknown'],the german novelists: | tales selected from ancient and modern authors in that language: from the earliest period down to the close of the eighteenth century. tr. from the originals: with critical and biographical notices. | $c: by thomas roscoe ... j. g. g. busching: j. g. g. busching:,False,True
inu.32000006996476,"Lee, Sophia","Lee, Sophia",1750-1824.,1826.0,1824.0,s,1826,    ,"London;Longman, Rees, Orme, Brown, and Green;1826.",1826,"5th ed.|v.1. The young lady's tale (The two Emilys) v.2. The young lady's tale (The two Emilys) (cont'd) Pembroke, or, The clergyman's tale.",,,,,22961378.0,enk,6059139,1,1.0,1.0,v.1,1.0,"Canterbury tales of the late Sophia Lee: consisting of The two Emilys, and Pembroke, or The Clergyman's tale ...",,True,"Canterbury tales of the late Sophia Lee: consisting of The two Emilys, and Pembroke, or The Clergyman's tale",0.2947186703131271,0.2038341431948974,Sophia,f,7.3125,4.196986607142857,25.088757396449704,7.211057035818074,233.53846153846155,915.8698224852072,2.1,['fiction'],['unknown'],"canterbury tales of the late sophia lee: consisting of the two emilys, and pembroke, or the clergyman's tale ...  canterbury tales of the late sophia lee: consisting of the two emilys, and pembroke, or the clergyman's tale",False,True
uc2.ark+=13960=t25b03g2t,"Banim, John","Banim, John",1798-1842.,1826.0,1826.0,s,1826,    ,London;Printed for W. Simpkin and R. Marshall;1826.,1826,,,,,,14268326.0,enk,7685498,1,1.0,1.0,v.0003,3.0,Tales,,True,Tales,0.1440938177554553,0.0398268327143261,John,m,9.484029484029485,22.8099415028162,29.55609756097561,24.50538964901844,228.4390243902439,1538.6170136823318,1.9,['fiction'],['unknown'],tales  tales,False,True
umn.31951002081141q,,,,1826.0,1826.0,s,1826,    ,"London;Sherwood, Gilbert, and Piper [etc., etc.;1826.",1826,,,Ghost stories,,,62602383.0,enk,8560131,1,1.0,1.0,,,"Legends of terror! : | and tales of the wonderful and the wild : original and select, in prose and verse ...",,True,"Legends of terror! : and tales of the wonderful and the wild : original and select, in prose and verse",0.2370906327378105,0.0445266864253471,,unknown,24.0375,66.68296874999999,95.26242236024844,539.7432463060838,739.416149068323,28181.28955287219,1.4,['unknown'],['unknown'],"legends of terror! : | and tales of the wonderful and the wild : original and select, in prose and verse ...  legends of terror! : and tales of the wonderful and the wild : original and select, in prose and verse",False,True
nyp.33433068187453,,,,1826.0,1826.0,s,1826,    ,"London;Sherwood, Gilbert, and Piper;1826.",1826,,,Tales,,,6192714.0,enk,8622384,1,1.0,1.0,,,"Legends of terror! : | and tales of the wonderful and wild ; original and select, in prose and verse / with historical illustrations, and elegant engravings on wood.",,True,"Legends of terror! : and tales of the wonderful and wild ; original and select, in prose and verse / with historical illustrations, and elegant engravings on wood",0.2065486629977958,0.050593083886505,,unknown,23.07389937106918,59.78541938610024,93.69517884914464,523.1388103490393,726.348367029549,28193.356089868405,1.3,['fiction'],['unknown'],"legends of terror! : | and tales of the wonderful and wild ; original and select, in prose and verse / with historical illustrations, and elegant engravings on wood.  legends of terror! : and tales of the wonderful and wild ; original and select, in prose and verse / with historical illustrations, and elegant engravings on wood",False,True
nyp.33433074955489,"Banim, John","Banim, John",1798-1842.,1826.0,1826.0,s,1826,    ,London;H. Colburn;1826.,1826,,,,Ireland,,17421425.0,enk,8663572,2,2.0,2.0,v. 1,1.0,"Tales by the O'Hara family : | second series : comprising the Nowlans, and Peter of the castle.",,True,"Tales by the O'Hara family : second series : comprising the Nowlans, and Peter of the castle",0.1110628983388596,0.0036910633921468,John,m,6.39209726443769,25.78850897534206,25.837758112094395,52.82618494444009,244.3746312684366,4166.552866751942,1.3,['fiction'],['unknown'],"tales by the o'hara family : | second series : comprising the nowlans, and peter of the castle.  tales by the o'hara family : second series : comprising the nowlans, and peter of the castle",False,True
mdp.39015005282192,"Griffin, Gerald","Griffin, Gerald",1803-1840.,1827.0,1827.0,s,1827,    ,London;Printed for W. Simpkin and R. Marshall;1827.,1827,Holland-tide.--The Aylmers of Bally-Aylmer.--The hand and word.--Saint Martin's day.--The brown man.--Persecutions of Jack-Edy.--The unburied legs.--Owney and Owney-na-Peak.--Conclusion.,,,,,4853799.0,enk,244793,1,2.0,2.0,,,"Holland-tide; | or, Munster popular tales ...",,True,"Holland-tide; or, Munster popular tales",0.1456741095607399,0.0193910213551125,Gerald,m,7.150537634408602,11.649381431379348,23.65171503957784,23.741494420116823,216.7730870712401,2573.436637171838,1.7,['fiction'],['unknown'],"holland-tide; | or, munster popular tales ...  holland-tide; or, munster popular tales",False,True
uc2.ark+=13960=t38053g3z,"Normanby, Constantine Henry Phipps","Normanby, Constantine Henry Phipps",,1827.0,1827.0,s,1827,    ,London;Saunders and Otley;1827.,1827,,,,,PZ3.N789H,13343560.0,enk,7690792,2,2.0,2.0,v.1,1.0,"Historiettes; or, Tales of continental life",The regicide's family. A week at Tours,True,The regicide's family. A week at Tours,0.0629893366919958,0.0231732510629454,Constantine,m,7.600583090379009,8.578075461754882,25.02279202279202,31.41258593680247,175.37037037037038,2023.7431676690933,1.5,['fiction'],['fiction and juvenile belles lettres'],"historiettes; or, tales of continental life the regicide's family. a week at tours the regicide's family. a week at tours",False,True
uc1.b3327536,"Marquess of, Normanby, Constantine Henry Phipps","Marquess of, Normanby, Constantine Henry Phipps",1797-1863.,1827.0,1827.0,s,1827,    ,London;Saunders and Otley;1827.,1827,v. 1. The regicide's family. A week at Tours.--v. 2. The fall of Bern.--v. 3. The German lottery. The Rhine. The castle of the Convent lake. L'envoi.,,,,PZ3.N789H,13343560.0,enk,7690792,2,2.0,2.0,v. 2,2.0,"Historiettes; or, Tales of continental life. | $c: By the author of ""The English in Italy ... """,The fall of Bern,True,The fall of Bern,0.0,0.0,Normanby,unknown,7.701704545454546,8.385451639979339,20.896358543417367,17.46544892466791,174.20728291316527,1582.3491906566546,1.0,['fiction'],['fiction and juvenile belles lettres'],"historiettes; or, tales of continental life. | $c: by the author of ""the english in italy ... "" the fall of bern the fall of bern",False,True
uc2.ark+=13960=t24b33088,"Normanby, Constantine Henry Phipps","Normanby, Constantine Henry Phipps",,1827.0,1827.0,s,1827,    ,London;Saunders and Otley;1827.,1827,,,,,PZ3.N789H,13343560.0,enk,7690792,2,2.0,2.0,v.3,3.0,"Historiettes; or, Tales of continental life",The German lottery. The Rhine. The castle of the Convent lake. L'envoi,True,The German lottery. The Rhine. The castle of the Convent lake. L'envoi,0.1238858126578188,0.024837428918285,Constantine,m,8.096273291925465,17.807501639597238,25.46319018404908,37.02165117241898,182.0828220858896,2144.345901238285,2.3,['fiction'],['fiction and juvenile belles lettres'],"historiettes; or, tales of continental life the german lottery. the rhine. the castle of the convent lake. l'envoi the german lottery. the rhine. the castle of the convent lake. l'envoi",False,True
uc1.b3322290,"Banim, John","Banim, John",1798-1842.,1827.0,1827.0,s,1827,    ,London;H. Colburn;1827.,1827,New ed.|v. 1-2. The Nowlans -- v. 3. Peter of the castle.,,Social life and customs|19th century,Ireland,,37351592.0,enk,7915207,2,3.0,2.0,v.1,1.0,Tales by the O'Hara family. | $n: Second series.,The Nowlans,True,The Nowlans,0.1254167244072724,0.0047998127330672,John,m,6.586102719033232,26.84077363295333,26.170149253731346,22.439705947872586,250.2955223880597,3176.5604277121847,2.3,['fiction'],['unknown'],tales by the o'hara family. | $n: second series. the nowlans the nowlans,False,True
njp.32101066478106,"Banim, John","Banim, John",1798-1842.,1827.0,1827.0,s,1827,    ,London;H. Colburn;1827.,1827,New ed.|v. 1-2. The Nowlans -- v. 3. Peter of the castle.,,Social life and customs|19th century,Ireland,,37351592.0,enk,7915207,2,2.0,2.0,v.3,3.0,Tales by the O'Hara family. | $n: Second series.,Peter of the castle,True,Peter of the castle,0.0,0.0,John,m,8.046753246753246,13.431580367684266,25.65552699228792,17.398047858525917,249.5089974293059,2340.5481195604043,1.2,['fiction'],['unknown'],tales by the o'hara family. | $n: second series. peter of the castle peter of the castle,False,True
uc1.b3322730,"Hood, Thomas","Hood, Thomas",1799-1845.,1827.0,1827.0,s,1827,    ,London;William H. Ainsworth;1827.,1827,Contents: v. 1 The Spanish tragedy. The miracle of the holy hermit. The widow of Galicia. The golden cup and the dish of silver. The tragedy of Seville. The lady in love with romance. The eighth sleeper of Ephesus. Madeline.Masetto and his mare. The story of Michel Argenti. The three jewels. Geronimo and Ghisola. The fall of the leaf. Baranga.--v. 2 The exile. The owl. The German knight. The Florentine kinsmen. The carrier's wife. The two faithful lovers of Sicily. The Venetan countess. A tale ,,,,,21431300.0,enk,7915373,1,1.0,1.0,v.1,1.0,National tales / | $c: by Thomas Hood.,The Spanish tragedy. The miracle of the holy hermit. The widow of Galicia. The golden cup and the dish of silver. The tragedy of Seville. The lady in love with romance. The eighth sleeper of Ephesus. Madeline.Masetto and his mare. The story of Michel Argenti. The three jewels. Geronimo and Ghisola. The fall of the leaf. Baranga,True,The Spanish tragedy. The miracle of the holy hermit. The widow of Galicia. The golden cup and the dish of silver. The tragedy of Seville. The lady in love with romance. The eighth sleeper of Ephesus. Madeline.Masetto and his mare. The story of Michel Argenti. The three jewels. Geronimo and Ghisola. The fall of the leaf. Baranga,0.2472421652116004,0.0234178252390108,Thomas,m,5.367521367521367,3.634158813645994,19.59493670886076,30.89921486941195,172.81012658227849,2842.9977033595046,2.5,['unknown'],['unknown'],national tales / | $c: by thomas hood. the spanish tragedy. the miracle of the holy hermit. the widow of galicia. the golden cup and the dish of silver. the tragedy of seville. the lady in love with romance. the eighth sleeper of ephesus. madeline.masetto and his mare. the story of michel argenti. the three jewels. geronimo and ghisola. the fall of the leaf. baranga the spanish tragedy. the miracle of the holy hermit. the widow of galicia. the golden cup and the dish of silver. the tragedy of seville. the lady in love with romance. the eighth sleeper of ephesus. madeline.masetto and his mare. the story of michel argenti. the three jewels. geronimo and ghisola. the fall of the leaf. baranga,False,True
uc1.b3322731,"Hood, Thomas","Hood, Thomas",1799-1845.,1827.0,1827.0,s,1827,    ,London;William H. Ainsworth;1827.,1827,Contents: v. 1 The Spanish tragedy. The miracle of the holy hermit. The widow of Galicia. The golden cup and the dish of silver. The tragedy of Seville. The lady in love with romance. The eighth sleeper of Ephesus. Madeline.Masetto and his mare. The story of Michel Argenti. The three jewels. Geronimo and Ghisola. The fall of the leaf. Baranga.--v. 2 The exile. The owl. The German knight. The Florentine kinsmen. The carrier's wife. The two faithful lovers of Sicily. The Venetan countess. A tale ,,,,,21431300.0,enk,7915373,1,1.0,1.0,v. 2,2.0,National tales / | $c: by Thomas Hood.,The exile. The owl. The German knight. The Florentine kinsmen. The carrier's wife. The two faithful lovers of Sicily. The Venetan countess. A tale,True,The exile. The owl. The German knight. The Florentine kinsmen. The carrier's wife. The two faithful lovers of Sicily. The Venetan countess. A tale,0.6292133701486436,0.5893310204037275,Thomas,m,5.211453744493392,4.131498767684217,19.565217391304348,30.593572778827983,174.51739130434785,3022.15404536862,2.5,['unknown'],['unknown'],national tales / | $c: by thomas hood. the exile. the owl. the german knight. the florentine kinsmen. the carrier's wife. the two faithful lovers of sicily. the venetan countess. a tale the exile. the owl. the german knight. the florentine kinsmen. the carrier's wife. the two faithful lovers of sicily. the venetan countess. a tale,False,True
njp.32101064790940,"Sutherland, Alexander","Sutherland, Alexander",,1827.0,1827.0,s,1827,    ,Edinburgh;Hunter;1827.,1827,2d ed.,,,,,42012710.0,stk,8921593,1,1.0,1.0,,,Tales of a pilgrim.,,True,Tales of a pilgrim,0.1658029045737814,0.0021125882750985,Alexander,m,9.672972972972971,14.468728999269542,27.72311827956989,20.84000317955833,271.1639784946237,2863.9919282576016,2.4,['unknown'],['unknown'],tales of a pilgrim.  tales of a pilgrim,False,True
hvd.hnn97y,"Hood, Thomas","Hood, Thomas",1799-1845.,1827.0,1827.0,s,1827,    ,London;William H. Ainsworth;1827.,1827,"1st ed., lacking final leaf of book advertisements in v.2.|v. 1 The Spanish tragedy. The miracle of the holy hermit. The widow of Galicia. The golden cup and the dish of silver. The tragedy of Seville. The lady in love with romance. The eighth sleeper of Ephesus. Madeline. Masetto and his mare. The story of Michel Argenti. The three jewels. Geronimo and Ghisola. The fall of the leaf. Baranga.--v. 2 The exile. The owl. The German knight. The Florentine kinsmen. The carrier's wife. The two faithf",,,,,8746181.0,enk,9718635,1,1.0,1.0,,,"National tales / | $c: by Thomas Hood, author of ""Whims and Oddities."" | $n: 1",,True,National tales,0.0,0.0,Thomas,m,5.308533916849015,3.801962183204134,19.49036402569593,33.2820270623461,173.16702355460384,3040.027777650409,2.8,['fiction'],['fiction and juvenile belles lettres'],"national tales / | $c: by thomas hood, author of ""whims and oddities."" | $n: 1  national tales",False,True
hvd.hw2cmg,"Carlyle, Thomas","Carlyle, Thomas",1795-1881.,1827.0,1827.0,s,1827,    ,London;Chapman & Hall;1827.,1827,,,,,,236058741.0,enk,9718857,1,1.0,1.0,v.1,1.0,"Tales by Musaeus, Tieck, Richter. | $c: Translated from the German By Thomas Carlyle.",,True,"Tales by Musaeus, Tieck, Richter",0.0896906511803891,0.074600138082983,Thomas,m,14.666666666666666,47.95218002812938,38.20083682008368,49.53288632902086,454.418410041841,8878.586439313038,3.1,['unknown'],['unknown'],"tales by musaeus, tieck, richter. | $c: translated from the german by thomas carlyle.  tales by musaeus, tieck, richter",False,True
mdp.39015065764063,"Thomson, Richard","Thomson, Richard",1794-1865.,1828.0,1828.0,s,1828,    ,London;H. Colburn;1828.,1828,,,,,,4653693.0,enk,122613,2,1.6666666666666667,1.6666666666666667,v.1,1.0,"Tales of an antiquary: | chielfy illustrative of the manners, traditions, and remarkable localities of ancient London.",,True,"Tales of an antiquary: chielfy illustrative of the manners, traditions, and remarkable localities of ancient London",0.3041101428558159,0.6018771155852014,Richard,m,6.407103825136612,7.43809161217116,25.868073878627968,24.09869048530712,233.598944591029,2779.237571445479,0.7,['fiction'],['unknown'],"tales of an antiquary: | chielfy illustrative of the manners, traditions, and remarkable localities of ancient london.  tales of an antiquary: chielfy illustrative of the manners, traditions, and remarkable localities of ancient london",False,True
mdp.39015064415188,"Banim, John","Banim, John",1798-1842.,1828.0,1828.0,s,1828,    ,London;H. Colburn;1828.,1828,,War stories|Historical fiction,"18th century|History|Rebellion of 1798|History, Military",Ireland,PZ3.B225Cro2,6707061.0,enk,429318,1,1.0,1.0,v.1,1.0,"The croppy; | a tale of 1798. | $c: By the authors of ""The O'Hara tales,"" ""The Nowlans,"" and ""The Boyne water."" ... | $n: v. 1",,True,The croppy; a tale of 1798,0.0,0.0,John,m,7.126182965299685,7.359472181034739,25.79192546583851,20.79210871494156,236.80434782608697,2575.623210910073,1.7,"['urn:uuid:898b24f1-ce41-4d63-acbc-950fbda1dfac', 'urn:uuid:953177bd-84dd-4c30-a89d-813198706bc0']",['english literature'],"the croppy; | a tale of 1798. | $c: by the authors of ""the o'hara tales,"" ""the nowlans,"" and ""the boyne water."" ... | $n: v. 1  the croppy; a tale of 1798",False,True
njp.32101068164191,,,,1828.0,1828.0,s,1828,    ,London;H. Colburn;1828.,1828,,,,,PZ3.N5625,22376203.0,enk,8721857,2,2.0,2.0,vol.1,1.0,"The Night watch, or, Tales of the sea. | $n: 1",,True,"The Night watch, or, Tales of the sea. $n: 1",0.4662053255279304,0.0688948599640634,,unknown,6.7407407407407405,19.49451303155007,22.7,99.64636363636362,188.5515151515152,3994.726134067952,1.5,['fiction'],['fiction and juvenile belles lettres'],"the night watch, or, tales of the sea. | $n: 1  the night watch, or, tales of the sea. $n: 1",False,True
uiuo.ark+=13960=t3bz6rg8w,,,,1828.0,1828.0,s,1828,    ,London;H. Colburn;1828.,1828,,,,,PZ3.N5625,22376203.0,enk,8721857,2,2.0,2.0,v.2,2.0,"The Night watch, or, Tales of the sea",,True,"The Night watch, or, Tales of the sea",0.0,0.0,,unknown,7.091715976331361,14.870286404537657,24.423188405797102,28.806418819575725,184.58260869565217,2526.9156395715186,1.5,['fiction'],['fiction and juvenile belles lettres'],"the night watch, or, tales of the sea  the night watch, or, tales of the sea",False,True
njp.32101066458132,"Corbett, M","Corbett, M",,1828.0,1828.0,s,1828,    ,Edinburgh;Printed for Cadell and Co.;1828.,1828,,,,,,38701708.0,stk,8928078,1,2.0,2.0,v.1,1.0,"Tales and legends / | $c: by the authors of ""The odd volume,"" &c.",,True,Tales and legends,0.0167829030266334,0.0349405397685741,M,unknown,9.33048433048433,10.152888369412585,24.527932960893853,26.26597952623201,235.7513966480447,3396.4381963733963,1.5,['unknown'],['unknown'],"tales and legends / | $c: by the authors of ""the odd volume,"" &c.  tales and legends",False,True
hvd.32044086802246,"Carne, John","Carne, John",1789-1844.,1828.0,1828.0,s,1828,    ,London;H. Colburn;1828.,1828,,,,,,899492.0,enk,9718281,1,2.5,2.5,v.1,1.0,Tales of the West. | $c: By the author of Letters from the East.,,True,Tales of the West,0.2901050108906797,0.0025081386772418,John,m,6.006389776357827,3.309863324112729,22.339563862928348,22.80993002785299,205.3177570093458,2476.185634844382,1.3,['unknown'],['unknown'],tales of the west. | $c: by the author of letters from the east.  tales of the west,False,True
mdp.39015065444443,"St. Leger, Barry","St. Leger, Barry",1799-1829.,1829.0,1829.0,s,1829,    ,London;H. Colburn;1829.,1829,"[1st ed.]|I. Lord Lovel's daughter.  The Bohemian.--II. The Bohemian, continued.  Second love.--III. Second love, continued.",,,,,2043315.0,enk,206911,2,2.0,2.0,v.1,1.0,"Tales of passion ... | $c: By the author of ""Gilbert Earle"" ... | $n: 1",Lord Lovel's daughter.  The Bohemian,True,Lord Lovel's daughter.  The Bohemian,0.0810279322135861,0.0022605479712912,Barry,m,8.233438485804417,11.036989123187611,23.229813664596275,30.3074341267698,214.43478260869568,2482.736429921685,1.2,['unknown'],['english literature'],"tales of passion ... | $c: by the author of ""gilbert earle"" ... | $n: 1 lord lovel's daughter.  the bohemian lord lovel's daughter.  the bohemian",False,True
mdp.39015065444294,"St. Leger, Barry","St. Leger, Barry",1799-1829.,1829.0,1829.0,s,1829,    ,London;H. Colburn;1829.,1829,"[1st ed.]|I. Lord Lovel's daughter.  The Bohemian.--II. The Bohemian, continued.  Second love.--III. Second love, continued.",,,,,2043315.0,enk,206911,2,2.0,2.0,v.2,2.0,"Tales of passion ... | $c: By the author of ""Gilbert Earle"" ... | $n: 1","The Bohemian, continued.  Second love",True,"The Bohemian, continued.  Second love",0.0581664795593143,0.0035524124612531,Barry,m,8.315625,8.378505859375,23.18885448916409,18.023157511334336,215.8513931888545,2007.804541402678,1.8,['unknown'],['english literature'],"tales of passion ... | $c: by the author of ""gilbert earle"" ... | $n: 1 the bohemian, continued.  second love the bohemian, continued.  second love",False,True
uiuo.ark+=13960=t88g98p6w,"[St. Leger, Francis Barry Boyle]","[St. Leger, Francis Barry Boyle]",,1829.0,1829.0,s,1829,    ,London;H. Colburn;1829.,1829,,,,,,2043315.0,enk,206911,2,2.0,2.0,v.3,3.0,Tales of passion,"Second love, continued",True,"Second love, continued",0.0835696375477092,0.0026255579174106,Francis,m,9.944598337950138,37.891667497947374,26.65934065934066,32.087247916918244,228.87637362637363,2954.311639596667,2.6,['unknown'],['english literature'],"tales of passion second love, continued second love, continued",False,True
nc01.ark+=13960=t26977x5c,"Jones, James Athearn","Jones, James Athearn",1791-1854.,1829.0,1829.0,s,1829,    ,London;H. Colburn and R. Bentley;1829.,1829,,,Folklore|Indians of North America,,,6596394.0,enk,559540,1,1.0,1.0,2,2.0,Tales of an Indian camp,,True,Tales of an Indian camp,0.5362462018214009,0.983971994636228,James,m,9.347432024169184,8.009200354140615,30.204747774480712,55.34976974350396,262.24035608308606,4302.930359517122,1.4,['unknown'],['unknown'],tales of an indian camp  tales of an indian camp,False,True
uiuo.ark+=13960=t7qn6rm83,"Scargill, William Pitt","Scargill, William Pitt",1787-1836.,1829.0,1829.0,s,1829,    ,London;H. Colburn and R. Bentley;1829.,1829,,,,,PR5299.S385T3 1829,13336186.0,enk,6502515,2,2.0,2.0,v.1,1.0,Tales of my time,,True,Tales of my time,0.5150221255858605,0.0393878062396396,William,m,6.94949494949495,7.778594021018263,26.11627906976744,12.25558216796724,205.4983388704319,1419.6985022240372,1.8,['fiction'],['unknown'],tales of my time  tales of my time,False,True
inu.32000006996674,"Malcolm, John","Malcolm, John, Sir",1769-1833.,1829.0,1829.0,s,1829,    ,"Edinburgh;Published by Oliver & Boyd, Tweeddale-court; and Simpkin & Marshall, London.;1829..",1829,,,"Army|Great Britain|Anecdotes|Military life|Malcolm, John",,,26339691.0,stk,7586213,1,1.0,1.0,,,"Tales of field and flood; : | with sketches of life at home. / | $c: By John Malcolm, ...",,True,Tales of field and flood; : with sketches of life at home,0.2810866068454569,0.002576803833736,John,m,5.456204379562044,5.1166950823165855,20.81118881118881,32.684630055259426,186.9020979020979,3186.934471123282,1.7,['unknown'],['unknown'],"tales of field and flood; : | with sketches of life at home. / | $c: by john malcolm, ...  tales of field and flood; : with sketches of life at home",False,True
uiuo.ark+=13960=t88g97x35,"Scargill, William Pitt","Scargill, William Pitt",1787-1836.,1829.0,1829.0,s,1829,    ,London;H. Colburn and R. Bentley;1829.,1829,,,,,,5257601.0,enk,8723667,1,2.0,2.0,v.1,1.0,Tales of a briefless barrister,,True,Tales of a briefless barrister,0.0647564469060382,0.0275807192863365,William,m,6.711974110032362,6.185649500947832,23.701587301587303,22.15221970269589,180.7206349206349,2038.1505265810029,1.5,['unknown'],['unknown'],tales of a briefless barrister  tales of a briefless barrister,False,True
uiuo.ark+=13960=t7np2q169,"Sherer, Moyle","Sherer, Moyle",1789-1869.,1829.0,1829.0,s,1829,    ,"London;Printed for Longman, Rees, Orme, Brown, and Green;1829.",1829,,,,,,6779802.0,enk,8723679,1,1.5,1.5,v.1,1.0,Tales of the wars of our times,,True,Tales of the wars of our times,0.0752875498554467,0.0544403769210101,Moyle,unknown,6.972602739726027,8.574591855882904,26.32249322493225,21.79030706296223,210.5040650406504,1893.474915724767,1.9,['fiction'],['unknown'],tales of the wars of our times  tales of the wars of our times,False,True
njp.32101066459692,"Mrs. Gore, (Catherine Grace Frances)","Gore, (Catherine Grace Frances), Mrs",1799-1861.,1829.0,1829.0,s,1829,    ,London;Saunders and Otley;1829.,1829,,,,,,21282750.0,enk,8928168,1,1.0,1.0,v.1,1.0,"Hungarian tales / | $c: by the Author of ""The lettre de Cachet"".",,True,Hungarian tales,0.0314461901074754,0.0493162606754155,Catherine,f,6.2746268656716415,5.488759189128983,22.679525222551927,12.609462089126431,197.73293768546,1235.9168082839508,1.7,['fiction'],['english literature'],"hungarian tales / | $c: by the author of ""the lettre de cachet"".  hungarian tales",False,True
