docid,oldauthor,author,authordate,inferreddate,latestcomp,datetype,startdate,enddate,imprint,imprintdate,contents,genres,subjects,geographics,locnum,oclc,place,recordid,instances,allcopiesofwork,copiesin25yrs,enumcron,volnum,title,parttitle,earlyedition,shorttitle,nonficprob,juvenileprob,first_name,estimated_gender,avg_sentence_count,var_sentence_count,avg_line_count,var_line_count,avg_tokens_per_page,var_tokens_per_page,cap_alpha_freq,genre_tag,lcc_category,full_title,stories_match,tales_match
uc2.ark+=13960=t58c9tv5d,"Witt, Karl","Witt, Karl",1815-1891.,1891.0,1891.0,s,1891,    ,"London;Longmans, Green;1891.",1891,,,"Tales, Greek|Mythology, Greek",,,13824483.0,enk,6500040,2,2.0,2.0,,,"Myths of Hellas, or, Greek tales, told in German by Professor C. Witt",,True,"Myths of Hellas, or, Greek tales, told in German by Professor C. Witt",0.7809059482525723,0.989627677521882,Karl,m,23.323432343234323,1211.3739393741355,43.408496732026144,751.6860715963944,352.53921568627453,17249.379181084198,2.8,['unknown'],['unknown'],"myths of hellas, or, greek tales, told in german by professor c. witt  myths of hellas, or, greek tales, told in german by professor c. witt",False,True
uc2.ark+=13960=t1wd3rv0q,"Robertson, Andrew","Robertson, Andrew",,1891.0,1891.0, ,1891,    ,"London;Longmans, Green, and Co.;1891.",1891,,,,,,11323939.0,enk,7682758,1,1.0,1.0,,,The kidnapped squatter and other australian tales,,True,The kidnapped squatter and other australian tales,0.3861892480423024,0.0464594677732659,Andrew,m,27.190283400809715,1336.1216869642185,36.20481927710844,417.9540329994678,283.28915662650604,13225.450524991533,2.9,['unknown'],['unknown'],the kidnapped squatter and other australian tales  the kidnapped squatter and other australian tales,False,True
uc2.ark+=13960=t4pk0cx70,"Shorthouse, J. H","Shorthouse, J. H. (Joseph Henry)",1834-1903.,1891.0,1888.0,r,1891,1888,London;New York;Macmillan and Co.;1891.,1891,,,,,,13356794.0,enk,7692469,1,1.0,1.0,,,A teacher of the violin and other tales,,True,A teacher of the violin and other tales,0.5488213682906865,0.4286883874655459,Joseph,m,40.29521276595744,6702.591040912177,48.62565445026178,3744.595467503632,297.6178010471204,103012.23088731122,2.3,['fiction'],['unknown'],a teacher of the violin and other tales  a teacher of the violin and other tales,False,True
njp.32101068970225,"Jerrold, Douglas William","Jerrold, Douglas William",1803-1857.,1891.0,1857.0,s,1891,    ,London;W. Paterson;1891.,1891,,,,,,5016410.0,enk,8975759,1,1.0,1.0,,,Tales : | now first collected / | $c: by Douglas Jerrold ; with a biographical notice by J. Logie Robertson.,,False,Tales : now first collected,0.2375586400207505,0.0443282269780346,Douglas,m,15.728900255754477,28.65796272918152,34.1493670886076,34.05617048549912,366.33417721518987,5340.019971158468,2.1,['unknown'],['unknown'],tales : | now first collected / | $c: by douglas jerrold ; with a biographical notice by j. logie robertson.  tales : now first collected,False,True
mdp.39015063938669,"Mrs. Humphrey, Frank Pope","Humphrey, Frank Pope, Mrs",,1892.0,1892.0,s,1892,    ,London;T. F. Unwin;1892.,1892,,,,,,16583941.0,enk,780878,2,2.0,2.0,,,"A New England cactus, and other tales.",,True,"A New England cactus, and other tales",0.0547378539625547,0.017498333760441,Frank,m,15.262443438914028,65.03519583956103,36.65625,54.50237165178572,281.13839285714283,4606.6013831313785,3.1,['fiction'],['unknown'],"a new england cactus, and other tales.  a new england cactus, and other tales",False,True
uc1.$b249245,"Anstey, F","Anstey, F",1856-1934.,1892.0,1892.0,s,1892,    ,"London;Smith, Elder;1892.",1892,,,English fiction,,,6380805.0,enk,6501908,2,3.0,3.0,,,The talking horse and other tales,,True,The talking horse and other tales,0.0733925053110263,0.3247273266383129,F,unknown,13.277945619335348,80.65990635353822,28.150442477876105,39.703030777664665,292.7315634218289,5748.845345933294,2.0,['unknown'],['unknown'],the talking horse and other tales  the talking horse and other tales,False,True
uc1.32106001728242,"Madame d' Aulnoy, (Marie-Catherine)","Madame d' Aulnoy, (Marie-Catherine)",1650 or 1651-1705.,1892.0,1705.0,s,1892,    ,London;Lawrence and Bullen;1892.,1892,,,Fairy tales,,,179285285.0,enk,7126888,1,1.0,1.0,,,The fairy tales of Madame d'Aulnoy / | $c: newly done into English with an introduction by Anne Thackeray Ritche ; illustrated by Clinton Peters.,,False,The fairy tales of Madame d'Aulnoy,0.1474324949602403,0.3569100876218127,Marie,f,24.310661764705884,53.35385691500865,36.80327868852459,56.22359580757861,568.3588342440802,18449.16996293974,1.7,['unknown'],['unknown'],the fairy tales of madame d'aulnoy / | $c: newly done into english with an introduction by anne thackeray ritche ; illustrated by clinton peters.  the fairy tales of madame d'aulnoy,False,True
uc1.b3321893,"Black, William","Black, William",1841-1898.,1892.0,1892.0,s,1892,    ,"London;Low, Marston;1892.",1892,,,,,,8466028.0,enk,7915057,2,2.0,2.0,,,Magic ink and other tales.,,True,Magic ink and other tales,0.1471551532060994,0.013790500639067,William,m,9.677083333333334,11.017252604166666,25.549488054607508,15.11444513040338,235.2559726962457,1761.6580274668315,1.8,['fiction'],['unknown'],magic ink and other tales.  magic ink and other tales,False,True
uc1.b3327637,"Sir, Quiller-Couch, Arthur Thomas","Quiller-Couch, Arthur Thomas, Sir",1863-1944.,1892.0,1892.0,s,1892,    ,London;Cassell Pub. Co.;1892,1892,,,,,PZ3.Q42I,1191746.0,enk,7923356,1,2.0,2.0,,,"I saw three ships, | and other winter tales, | $c: by Q [pseud.]",,True,"I saw three ships, and other winter tales",0.1017028746134569,0.1135685283218439,Arthur,m,11.20748299319728,16.327699106853622,22.65319865319865,20.46222040834836,209.45791245791247,2549.5546259451985,2.0,['unknown'],['fiction and juvenile belles lettres'],"i saw three ships, | and other winter tales, | $c: by q [pseud.]  i saw three ships, and other winter tales",False,True
mdp.39015067207459,"Snowden, Keighley","Snowden, Keighley",b. 1860.,1893.0,1893.0,s,1893,    ,"London;S. Low, Marston & company, limited;1893.",1893,,,,,,13138412.0,enk,781983,1,1.0,1.0,,,Tales of the Yorkshire wolds | $c: [by] J. Keighley Snowden.,,True,Tales of the Yorkshire wolds,0.1693497355403275,0.0516221143288503,Keighley,unknown,16.03125,35.16420200892857,27.951965065502183,31.635247230220628,310.6593886462882,5234.0586563948045,1.5,['fiction'],['unknown'],tales of the yorkshire wolds | $c: [by] j. keighley snowden.  tales of the yorkshire wolds,False,True
mdp.39015030074853,"Lie, Jonas Lauritz Idemil","Lie, Jonas Lauritz Idemil",1833-1908.,1893.0,1893.0,s,1893,    ,"London;K. Paul, Trench, Tr?_bner & co., ltd.;1893.",1893,,Legends,Norway|Legends,,,407679.0,enk,1788822,1,2.0,1.0,,,"Weird tales from northern seas, from the Danish of Jonas Lie, | $c: by R. Nisbet Bain. With twelve illustrations by Laurence Housman.",,True,"Weird tales from northern seas, from the Danish of Jonas Lie",0.1632011623687304,0.0988786279813199,Jonas,m,9.437158469945356,7.109438920242469,21.255102040816325,46.9859433569346,204.98469387755105,5254.372214702208,1.7,['unknown'],['unknown'],"weird tales from northern seas, from the danish of jonas lie, | $c: by r. nisbet bain. with twelve illustrations by laurence housman.  weird tales from northern seas, from the danish of jonas lie",False,True
mdp.39015019958241,Baitāl-Pachīsī,Baitāl-Pachīsī,,1893.0,1893.0,s,1893,    ,London;Tylston and Edwards;1893.,1893,,,,,,63868051.0,enk,1880987,1,1.0,1.0,,,"Vikram and the vampire; | or, Tales of Hindu devilry. | $c: Adapted by Richard F. Burton. Edited by his wife, Isabel Burton. With 33 illus. by Ernest Criset.",,True,"Vikram and the vampire; or, Tales of Hindu devilry",0.2982836834724907,0.5585145594428752,Baitl,unknown,12.95729537366548,27.78465318321703,31.262237762237763,106.93472785955304,329.1958041958042,13862.409213164456,2.5,['unknown'],['unknown'],"vikram and the vampire; | or, tales of hindu devilry. | $c: adapted by richard f. burton. edited by his wife, isabel burton. with 33 illus. by ernest criset.  vikram and the vampire; or, tales of hindu devilry",False,True
njp.32101062729072,"Drachmann, Holger","Drachmann, Holger",1846-1908.,1893.0,1893.0,s,1893,    ,London;Unwin;1893.,1893,,,,,,14704754.0,enk,7657996,2,2.0,2.0,,,"The cruise of the ""Wild Duck"", | and other tales.",,True,"The cruise of the ""Wild Duck"", and other tales",0.0,0.0,Holger,m,9.923076923076923,22.79921104536489,30.725888324873097,30.14821304336622,192.44162436548223,1847.089231879204,2.4,['fiction'],['unknown'],"the cruise of the ""wild duck"", | and other tales.  the cruise of the ""wild duck"", and other tales",False,True
uc2.ark+=13960=t1hh6kn16,"Black, William","Black, William",1841-1898.,1893.0,1893.0,s,1893,    ,"London;Sampson Low, Marston;1893.",1893,,,,,,8503046.0,enk,7695474,1,1.0,1.0,,,The penance of John Logan and two other tales,,True,The penance of John Logan and two other tales,0.0974346350741661,0.0108646584208237,William,m,11.251592356687896,19.748803196884253,31.81761006289308,32.97931252719433,242.21698113207543,1541.132164471342,2.9,['fiction'],['unknown'],the penance of john logan and two other tales  the penance of john logan and two other tales,False,True
uc1.31822038201455,"Basile, Giambattista","Basile, Giambattista",ca. 1575-1632.,1893.0,1632.0,s,1893,    ,London;Henry and Co.;1893,1893,,,,,,4507681.0,enk,10823844,1,1.0,1.0,v.1,1.0,"Il Pentamerone, or, The tale of tales : | being a translation by the late Sir Richard Burton of Il Pentamerone, overo, Lo cunto de li cunte, trattenemiento de li peccerille of Giovanni Battista Basile, count of Torone (Gian Alessio Abbattutis) ; in two volumes",,False,"Il Pentamerone, or, The tale of tales : being a translation by the late Sir Richard Burton of Il Pentamerone, overo, Lo cunto de li cunte, trattenemiento de li peccerille of Giovanni Battista Basile, count of Torone (Gian Alessio Abbattutis) ; in two volumes",0.5128519689440062,0.0804529294145494,Giambattista,m,8.976027397260275,17.537096547194594,30.76744186046512,60.97581704396198,334.4019933554817,11095.30351762122,1.3,['unknown'],['unknown'],"il pentamerone, or, the tale of tales : | being a translation by the late sir richard burton of il pentamerone, overo, lo cunto de li cunte, trattenemiento de li peccerille of giovanni battista basile, count of torone (gian alessio abbattutis) ; in two volumes  il pentamerone, or, the tale of tales : being a translation by the late sir richard burton of il pentamerone, overo, lo cunto de li cunte, trattenemiento de li peccerille of giovanni battista basile, count of torone (gian alessio abbattutis) ; in two volumes",False,True
uc1.$b281899,"Steel, Flora Annie Webster","Steel, Flora Annie Webster",1847-1929.,1894.0,1894.0,s,1894,    ,London;Macmillan;1894.,1894,,,Folklore|Punjab|India,,PZ8.1.S813Tal,387005.0,enk,1276839,2,4.0,3.0,,,Tales of the Punjab told by the people,,True,Tales of the Punjab told by the people,0.457371782985973,0.8231340978930789,Flora,f,14.847290640394087,83.51855177267102,30.67153284671533,85.01863001047828,340.978102189781,25474.785408563766,1.4,['fiction'],['fiction and juvenile belles lettres'],tales of the punjab told by the people  tales of the punjab told by the people,False,True
wu.89010164812,"Emerson, P. H. (Peter Henry)","Emerson, P. H. (Peter Henry)",1856-1936.,1894.0,1894.0,s,1894,    ,London;D. Nutt;1894.,1894,,,Wales|Fairy tales|Tales,,,4847808.0,enk,5776705,2,2.0,2.0,,,Welsh fairy-tales and other stories / | $c: collected and edited by P.H. Emerson.,,True,Welsh fairy-tales and other stories,0.6746229397867506,0.7355698424701165,Peter,m,10.684782608695652,41.60715973534971,24.75531914893617,91.71672702580354,236.6170212765957,8006.066093254865,2.7,['unknown'],['unknown'],welsh fairy-tales and other stories / | $c: collected and edited by p.h. emerson.  welsh fairy-tales and other stories,True,True
inu.39000000711106,"Robertson, Andrew","Robertson, Andrew",,1894.0,1894.0,s,1894,    ,"London;New York;Longmans, Green;1894.",1894,,,,,,11323943.0,enk,6061492,2,2.0,2.0,,,"Nuggets in the devil's punch bowl, | and other Australian tales.",,True,"Nuggets in the devil's punch bowl, and other Australian tales",0.2300037001170679,0.0192779749779643,Andrew,m,13.888372093023255,24.303818280151432,20.99126637554585,40.75974905131481,204.5240174672489,5123.000514864324,0.6,['fiction'],['unknown'],"nuggets in the devil's punch bowl, | and other australian tales.  nuggets in the devil's punch bowl, and other australian tales",False,True
uc2.ark+=13960=t9q23tn3h,"Emerson, P. H","Emerson, P. H. (Peter Henry)",1856-1936.,1894.0,1894.0, ,1894,    ,London;D. Nutt;1894.,1894,,,,,,4847800.0,enk,7679514,1,1.0,1.0,,,Tales from Welsh Wales,,True,Tales from Welsh Wales,0.5677462641339092,0.0299897538454421,Peter,m,15.509554140127388,38.612966043247184,42.05,93.80375,366.975,9210.936875,1.9,['unknown'],['unknown'],tales from welsh wales  tales from welsh wales,False,True
uc2.ark+=13960=t3rv0mk5j,"Hobbes, John Oliver","Hobbes, John Oliver",1867-1906.,1894.0,1894.0,s,1894,    ,London;T. Fisher Unwin;1894.,1894,,,,,,6309840.0,enk,7689015,1,4.0,4.0,,,The tales of John Oliver Hobbes [i.e. P. Craigie],,True,The tales of John Oliver Hobbes [i.e. P. Craigie],0.2708905855430833,0.0246455771896628,John,m,17.623318385650226,55.92985984033461,37.00443458980045,83.4279182501561,302.94235033259423,6958.098672081258,2.1,['fiction'],['unknown'],the tales of john oliver hobbes [i.e. p. craigie]  the tales of john oliver hobbes [i.e. p. craigie],False,True
uc2.ark+=13960=t1pg1wv9s,"Pearce, J. H","Pearce, J. H. (Joseph Henry)",,1894.0,1894.0,s,1894,    ,London;Lawrence and Bullen;1894.,1894,,,English fiction,,PZ3.P3145T,3354074.0,enk,7707894,1,2.0,2.0,,,Tales of the masque,,True,Tales of the masque,0.2111405748451258,0.0176472984435583,Joseph,m,7.54054054054054,13.556464572680786,23.448453608247423,46.5875491550643,142.89690721649484,2350.4635986821127,1.8,['unknown'],['fiction and juvenile belles lettres'],tales of the masque  tales of the masque,False,True
inu.30000114928652,"Hall-Stevenson, John","Hall-Stevenson, John",1718-1785.,1894.0,1785.0,s,1894,    ,London;s.n.;1894.,1894,,,,,,2529916.0,enk,8565564,1,1.0,1.0,,,Crazy tales / | $c: [John Hall-Stevenson],,False,Crazy tales,0.8120346370468584,0.2215524197155426,John,m,5.072847682119205,5.471514407262839,19.71895424836601,45.483104788756464,157.54248366013073,4595.895253962151,2.3,['fiction'],['unknown'],crazy tales / | $c: [john hall-stevenson]  crazy tales,False,True
nyp.33433082170824,"Aldrich, Thomas Bailey","Aldrich, Thomas Bailey, Mrs",1836-1907.,1894.0,1894.0,s,1894,    ,"Edinburgh, Scotland;David Douglas;1894.",1894,,,,,,10414541.0,stk,8657755,1,3.0,1.0,,,Two bites at a cherry ; | with other tales / | $c: by Thomas Bailey Aldrich.,,True,Two bites at a cherry ; with other tales,0.1314227500638811,0.0059500973239339,Thomas,m,11.458167330677291,26.85382771702037,25.705426356589147,36.48686977946036,209.0891472868217,3119.949417102338,2.4,['fiction'],['unknown'],two bites at a cherry ; | with other tales / | $c: by thomas bailey aldrich.  two bites at a cherry ; with other tales,False,True
uc1.$b703976,"Gueullette, Thomas-Simon","Gueullette, Thomas-Simon",1683-1766.,1894.0,1766.0,s,1894,    ,London;H. S. Nichols and co.;1894.,1894,,,,,,,enk,9971016,1,5.0,5.0,,,The transmigrations of the Mandarin Fum-Hoam (Chinese tales) / | $c: ed. by Leonard C. Smithers.,,False,The transmigrations of the Mandarin Fum-Hoam (Chinese tales),0.3968742751957397,0.4174504035453521,Thomas,m,9.717391304347826,11.137523629489603,29.874551971326166,37.60075024729898,323.741935483871,6775.5032951786325,2.0,['unknown'],['unknown'],the transmigrations of the mandarin fum-hoam (chinese tales) / | $c: ed. by leonard c. smithers.  the transmigrations of the mandarin fum-hoam (chinese tales),False,True
mdp.39015063548914,"Crockett, S. R. (Samuel Rutherford)","Crockett, S. R. (Samuel Rutherford)",1860-1914.,1895.0,1895.0,s,1895,    ,"London;Bliss, Sands & Foster;1895.",1895,,,,,,66267648.0,enk,286429,1,1.0,1.0,,,Bog-myrtle & peat; | tales chiefly of Galloway gathered from the years 1889 to 1895.,,True,Bog-myrtle & peat; tales chiefly of Galloway gathered from the years 1889 to 1895,0.2012060612668958,0.0467004604573029,Samuel,m,17.44776119402985,39.67513180366822,31.484261501210653,68.76791210595127,337.1985472154964,10269.277770286511,1.9,['unknown'],['unknown'],bog-myrtle & peat; | tales chiefly of galloway gathered from the years 1889 to 1895.  bog-myrtle & peat; tales chiefly of galloway gathered from the years 1889 to 1895,False,True
mdp.39015039507952,"Petrie, W. M. Flinders (William Matthew Flinders)","Petrie, W. M. Flinders (William Matthew Flinders)",1853-1942.,1895.0,1895.0,s,1895,    ,London;Methuen & co.;1895.,1895,,,,,,5392692.0,enk,1854592,1,1.0,1.0,v.2,2.0,Egyptian Tales translated from the papyri. | $c: Ed. by W[illiam] M[atthew] Flinders Petrie. Ill. by Tristram Ellis. Ser. 1. 2.,,True,Egyptian Tales translated from the papyri,0.9308248094368088,0.9798200200384442,William,m,6.470198675496689,7.096794000263147,20.243589743589745,79.20989480604865,171.31410256410257,5261.330826758712,5.8,['unknown'],['unknown'],egyptian tales translated from the papyri. | $c: ed. by w[illiam] m[atthew] flinders petrie. ill. by tristram ellis. ser. 1. 2.  egyptian tales translated from the papyri,False,True
inu.39000005797753,"Curtin, Jeremiah","Curtin, Jeremiah",1835-1906.,1895.0,1895.0,s,1895,    ,London;D. Nutt;1895.,1895,,,(OCoLC)fst00942396|(OCoLC)fst00930306|Fairies|Ghosts|Ireland|Tales|(OCoLC)fst01205427|Folklore|Munster|Fairy tales|Ghost stories|(OCoLC)fst00919916,Ireland,,4788381.0,enk,6935440,1,2.0,2.0,,,"Tales of the fairies and of the ghost world, | collected from the oral tradition in South-west Munster.",,True,"Tales of the fairies and of the ghost world, collected from the oral tradition in South-west Munster",0.7805122605915568,0.0087011863802746,Jeremiah,m,29.52884615384616,67.59532174556213,56.37272727272728,197.92471074380168,562.0818181818182,23504.12966942149,2.3,['unknown'],['unknown'],"tales of the fairies and of the ghost world, | collected from the oral tradition in south-west munster.  tales of the fairies and of the ghost world, collected from the oral tradition in south-west munster",False,True
uc2.ark+=13960=t4rj4b345,"Baring-Gould, S","Baring-Gould, S. (Sabine)",1834-1924.,1895.0,1895.0,s,1895,    ,London;Methuen;1895.,1895,,,Fairy tales,,,63065414.0,enk,7651962,1,1.0,1.0,,,A book of fairy tales,,True,A book of fairy tales,0.1235263446209361,0.9975059885547642,Sabine,f,31.97426470588235,2013.9147788711075,51.144404332129966,520.9033351144939,387.3429602888087,34634.579129142825,3.3,['unknown'],['unknown'],a book of fairy tales  a book of fairy tales,False,True
uc2.ark+=13960=t0gt5np3k,"Douglas, George","Douglas, George",,1895.0,1895.0,s,1895,    ,London;W. Scott;1895?,1895,,,,,,603661.0,enk,7695017,1,1.0,1.0,,,The new border tales,,True,The new border tales,0.2367473762551143,0.0014246032101859,George,m,10.86896551724138,12.534554102259216,31.598639455782312,39.11782127817113,260.6292517006803,2884.328532093109,2.0,['fiction'],['unknown'],the new border tales  the new border tales,False,True
nnc1.cu58966862,"Rydings, Egbert","Rydings, Egbert",,1895.0,1895.0,s,1895,    ,Manchester;J. Heywood;pref. 1895,1895,,,,,,13368685.0,enk,8435774,1,1.0,1.0,,,Manx tales; | $c: introd. pref. by T.E. Brown.,,True,Manx tales;,0.3796326777565506,0.0125736937980263,Egbert,m,12.228346456692911,17.829747659495318,29.571428571428573,52.36519871106338,390.1278195488722,12946.47238396744,1.3,['unknown'],['unknown'],manx tales; | $c: introd. pref. by t.e. brown.  manx tales;,False,True
nyp.33433039871201,"Edgeworth, Maria","Edgeworth, Maria",1767-1849.,1895.0,1849.0,s,1895,    ,"London, New York;Macmillan;1895.",1895,,,,,,,enk,8611935,1,1.0,1.0,,,Popular tales. | Illus. by Chris Hammond. With an introd. by Anne Thackeray Ritchie.,,False,Popular tales. Illus. by Chris Hammond. With an introd. by Anne Thackeray Ritchie,0.1687945961505498,0.6494387558742318,Maria,f,16.39071566731141,51.53012656712398,36.489483747609945,129.93248979084484,442.6367112810708,22231.053489757945,1.9,['fiction'],['unknown'],popular tales. | illus. by chris hammond. with an introd. by anne thackeray ritchie.  popular tales. illus. by chris hammond. with an introd. by anne thackeray ritchie,False,True
nyp.33433082531611,"Ewing, Juliana Horatia Gatty","Ewing, Juliana Horatia Gatty",1841-1885.,1895.0,1885.0,s,1895,    ,London;Society for Promoting Christian Knowledge;New York;E. & J. B. Young;1895,1895,Authorized ed.,,"Children's stories, English",,,5879236.0,enk,8654846,1,1.0,1.0,,,Melchior's dream : | and other tales / | $c: by Juliana Horatia Ewing.,,True,Melchior's dream : and other tales,0.185193886147954,0.7070327882688798,Juliana,f,12.118279569892474,19.05052607237831,25.97864768683274,20.11342308228113,261.7580071174377,2758.055318448348,2.2,['fiction'],['unknown'],melchior's dream : | and other tales / | $c: by juliana horatia ewing.  melchior's dream : and other tales,False,True
nyp.33433073356770,"Turgenev, Ivan Sergeevich","Turgenev, Ivan Sergi︠e︡evích",1818-1883.,1895.0,1883.0,s,1895,    ,London;Lamley;1895.,1895,,,,,,60409059.0,enk,8700291,1,1.0,1.0,,,Tales from the note-book of a sportsman. | $c: Trans. from the Russian by Edward Richter. Series 1.,,True,Tales from the note-book of a sportsman,0.2884177809489539,0.1198234530045438,Ivan,m,16.865900383141764,44.28469928509565,26.03409090909091,26.94959538567493,258.79545454545456,4294.60967630854,2.2,['unknown'],['unknown'],tales from the note-book of a sportsman. | $c: trans. from the russian by edward richter. series 1.  tales from the note-book of a sportsman,False,True
uc2.ark+=13960=t51g0rd75,"Blackmore, R. D","Blackmore, R. D. (Richard Dooddridge)",1825-1900.,1896.0,1896.0,s,1896,    ,"London;S. Low, Marston & Co.;1896.",1896,,,,,,1463336.0,enk,475876,3,3.0,3.0,,,Tales from the telling-house,,True,Tales from the telling-house,0.3295446071246583,0.4284903900191475,Richard,m,7.559523809523809,7.79407596371882,25.058365758754864,29.891535072446214,190.75875486381324,2079.38148950022,1.7,['urn:uuid:6837117a-a924-4f7c-9084-8f02ec7324c1'],['unknown'],tales from the telling-house  tales from the telling-house,False,True
wu.89096154828,"Chodzko, Alexander","Chodzko, Alexander",1804-1891.,1896.0,1891.0,s,1896,    ,London;George Allen;1896.,1896,,,Fairy tales,,PZ8.C432Fa,2717657.0,enk,1276470,3,3.0,3.0,,,Fairy tales of the Slav peasants and herdsmen / | $c: from the French of Alex. Chodsko ; translated and illustrated by Emily J. Harding.,,True,Fairy tales of the Slav peasants and herdsmen,0.2787429103688043,0.4439097901662004,Alexander,m,12.721804511278195,29.88501328509244,24.55956678700361,91.15619909030484,271.30685920577616,14840.674790496423,1.4,['fiction'],['fiction and juvenile belles lettres'],fairy tales of the slav peasants and herdsmen / | $c: from the french of alex. chodsko ; translated and illustrated by emily j. harding.  fairy tales of the slav peasants and herdsmen,False,True
inu.30000118310592,"Arndt, Ernst Moritz","Arndt, Ernst Moritz",1769-1860.,1896.0,1860.0,s,1896,    ,London;D. Nutt;1896.,1896,,,Rügen Island|Germany|Folklore|Fairy tales,,,398326.0,enk,1880658,2,2.0,2.0,,,"Fairy tales from the Isle of Rügen, | $c: by Ernst Moritz Arndt (1817) selected and tr. by Anna Dabis, with four of the original illustrations, portrait of E.M. Arndt, and map.",,False,Fairy tales from the Isle of Rügen,0.15109810667842,0.2320416557894235,Ernst,m,9.697211155378486,13.557721306011016,25.79069767441861,38.67712276906437,256.8255813953488,5177.733144041824,1.5,['unknown'],['unknown'],"fairy tales from the isle of rügen, | $c: by ernst moritz arndt (1817) selected and tr. by anna dabis, with four of the original illustrations, portrait of e.m. arndt, and map.  fairy tales from the isle of rügen",False,True
mdp.39015008788187,"Parker, K. Langloh (Katie Langloh)","Parker, K. Langloh (Katie Langloh)",1856-1940.,1896.0,1896.0,s,1896,    ,"London;D. Nutt;Melbourne;Melville, Mullen & Slade;1896",1896,,,"Folklore|Australia|Tales, Australian aboriginal",,,4888260.0,enk,1881124,1,8.0,5.0,,,"Australian legendary tales; | folklore of the Noongahburrahs as told to the piccaninnies; | $c: collected by Mrs. K. Langloh Parker. With introduction by Andrew Lang ... Illustrations by a native artist, and a specimen of the native text.",,True,Australian legendary tales; folklore of the Noongahburrahs as told to the piccaninnies;,0.5096497475281215,0.9232092471740414,Katie,f,14.827814569536423,103.34783562124468,24.97530864197531,113.4561804602957,265.55555555555554,13455.456790123457,1.9,['unknown'],['unknown'],"australian legendary tales; | folklore of the noongahburrahs as told to the piccaninnies; | $c: collected by mrs. k. langloh parker. with introduction by andrew lang ... illustrations by a native artist, and a specimen of the native text.  australian legendary tales; folklore of the noongahburrahs as told to the piccaninnies;",False,True
