docid,oldauthor,author,authordate,inferreddate,latestcomp,datetype,startdate,enddate,imprint,imprintdate,contents,genres,subjects,geographics,locnum,oclc,place,recordid,instances,allcopiesofwork,copiesin25yrs,enumcron,volnum,title,parttitle,earlyedition,shorttitle,nonficprob,juvenileprob,first_name,estimated_gender,avg_sentence_count,var_sentence_count,avg_line_count,var_line_count,avg_tokens_per_page,var_tokens_per_page,cap_alpha_freq,genre_tag,lcc_category,full_title,stories_match,tales_match
nyp.33433074902606,"MacWalter, J. G","MacWalter, J. G",,1854.0,1854.0,s,1854,    ,London;John Farquhar Shaw;1854.,1854,"Betty Brien's fortune.--The Terry Alt.--A memoir of Mortimer Mack-Harty, Esq.",,,,,5282849.0,enk,8666734,1,1.0,1.0,,,Tales of Ireland and the Irish.,,True,Tales of Ireland and the Irish,0.1542639968998221,0.1338525133569829,J,unknown,11.931174089068826,74.20174072677801,24.67063492063492,32.26056626354246,234.1706349206349,4523.490724993701,2.2,['unknown'],['unknown'],tales of ireland and the irish.  tales of ireland and the irish,False,True
uiuo.ark+=13960=t7tm7vt5j,,,,1854.0,1854.0,s,1854,    ,London;G. Berger;1854?,1854,,,,,PZ1.T149,66128777.0,enk,8723669,1,1.0,1.0,v.1,1.0,Tales of chivalry,,True,Tales of chivalry,0.3332411895707826,0.0736888160186906,,unknown,26.504608294930875,80.95965618297267,121.27231121281464,664.0974713173341,842.1121281464531,39329.67392613461,9.4,['unknown'],['fiction and juvenile belles lettres'],tales of chivalry  tales of chivalry,False,True
uc1.b3311758,"Wilson, John","Wilson, John",1951 Aug. 2-,1855.0,1854.0,s,1855,    ,Edinburgh;London;W. Blackwood;1855-58.,1855-1858,v. 1-4. Noctes ambrosianae.--v. 5-8. Essays critical and imaginative.--v. 9-10. Recreations of Christopher North.--v. 11. Tales.--v. 12. Poetical works.,,,,PR5835.A2 1855,4163660.0,stk,6130350,2,3.0,3.0,v.11,11.0,"The works of Professor Wilson of the University of Edinburgh, | $c: edited by his son-in-law Professor Ferrier.",Tales,True,Tales,0.1209203380262895,0.0473335563313682,John,m,18.089605734767023,24.461504862476072,45.90088495575221,49.44858328764977,634.3238938053097,12463.48270342235,1.9,['unknown'],['english literature'],"the works of professor wilson of the university of edinburgh, | $c: edited by his son-in-law professor ferrier. tales tales",False,True
uc2.ark+=13960=t56d5s50t,"Conscience, Hendrik","Conscience, Hendrik",1812-1883.,1855.0,1855.0,s,1855,    ,Edinburgh;Constable;1855.,1855,,,,,,14630741.0,stk,7656249,1,1.0,1.0,,,Tales of Flemish life,,True,Tales of Flemish life,0.0451802771499647,0.0175190328798437,Hendrik,m,17.264864864864865,36.8109276844412,38.32978723404256,61.36464463558169,352.76329787234044,6019.021099762336,3.1,['unknown'],['unknown'],tales of flemish life  tales of flemish life,False,True
nyp.33433068197767,"Madame d' Aulnoy, (Marie-Catherine)","Madame d' Aulnoy, (Marie-Catherine)",1650 or 1651-1705.,1855.0,1705.0,s,1855,    ,London;G. Routledge;1855.,1855,,,Fairy tales,,,6998274.0,enk,8622405,1,1.0,1.0,,,Fairy tales / | $c: by the countess d'Aulnoy ; translated by J. R. Planché ; with illustrations by John Gilbert.,,False,Fairy tales,0.3174024933570601,0.8135405545989945,Marie,f,19.093354430379748,43.89160140602468,39.5925925925926,54.698216735253766,471.94135802469134,11519.502733958238,2.3,['unknown'],['unknown'],fairy tales / | $c: by the countess d'aulnoy ; translated by j. r. planché ; with illustrations by john gilbert.  fairy tales,False,True
njp.32101013520869,"Stowe, Harriet Beecher","Stowe, Harriet Beecher",1811-1896.,1855.0,1855.0,s,1855,    ,London;Sampson Low;1855.,1855,Author's cheap ed.,,,,,10335083.0,enk,8883950,1,1.0,1.0,,,"Tales and sketches of New England life : | comprising ""The Mayflower,"" and other miscellaneous writings / | $c: by Harriet Beecher Stowe.",,True,"Tales and sketches of New England life : comprising ""The Mayflower,"" and other miscellaneous writings",0.1758520025366135,0.0234509504370912,Harriet,f,18.05187319884726,97.68606997815778,37.45272206303725,32.86094531243587,474.7621776504298,7973.722810157554,2.1,['unknown'],['unknown'],"tales and sketches of new england life : | comprising ""the mayflower,"" and other miscellaneous writings / | $c: by harriet beecher stowe.  tales and sketches of new england life : comprising ""the mayflower,"" and other miscellaneous writings",False,True
njp.32101067640886,,,,1855.0,1855.0,s,1855,    ,London;Blackwood;1855,1855,,,,,,41221499.0,enk,8961700,1,1.0,1.0,,,Tales of the mountains.,,True,Tales of the mountains,0.1955803749368617,0.0624585852389738,,unknown,10.676737160120846,26.5269210759303,35.94328358208955,52.620663844954336,374.13432835820896,6712.802851414569,2.0,['unknown'],['unknown'],tales of the mountains.  tales of the mountains,False,True
nyp.33433071388676,"Edmonston, Eliza","Edmonston, Eliza",,1856.0,1856.0,s,1856,    ,Edinburgh;S. & K.;1856.,1856,,,,Shetland (Scotland),,11894987.0,stk,8687446,1,1.0,1.0,,,Sketches and tales of the Shetland Islands.,,True,Sketches and tales of the Shetland Islands,0.6628710272745475,0.2729187331006312,Eliza,f,8.992366412213741,9.083911193986363,29.098484848484848,49.74787649219466,274.6136363636364,5178.562844352617,2.3,['unknown'],['unknown'],sketches and tales of the shetland islands.  sketches and tales of the shetland islands,False,True
mdp.39015065541032,"Tupper, Martin Farquhar","Tupper, Martin Farquhar",1810-1889.,1857.0,1857.0,s,1857,    ,"London;Arthur Hall, Virtue;1857.",1857,A new ed. /|with designs by John Leech.,,,,,460064297.0,enk,5263734,1,1.0,1.0,,,"The crock of gold, and other tales / | $c: by Martin Farquhar Tupper.",,True,"The crock of gold, and other tales",0.0874927215108353,0.0864921911894788,Martin,m,11.643605870020965,37.81009014235548,30.561475409836067,77.68884372480515,360.7581967213115,16081.740711502289,1.6,['fiction'],['unknown'],"the crock of gold, and other tales / | $c: by martin farquhar tupper.  the crock of gold, and other tales",False,True
uc2.ark+=13960=t5v69bm8g,"Wilson, John Mackay","Wilson, John Mackay",1804-1835.,1857.0,1835.0,s,1857,    ,Edinburgh;W. P. Nimmo;1857?,1857,,,Borders of Scotland,,,11686900.0,stk,7693879,1,1.0,1.0,v.05,5.0,Tales of the borders and of Scotland,,True,Tales of the borders and of Scotland,0.2045205911986762,0.0531981658303986,John,m,14.038528896672505,26.720056679988097,38.43804537521815,36.28804644122207,391.9825479930192,4761.158508690978,2.9,['unknown'],['unknown'],tales of the borders and of scotland  tales of the borders and of scotland,False,True
uc2.ark+=13960=t4wh2h853,"Wilson, John Mackay","Wilson, John Mackay",1804-1835.,1857.0,1835.0,m,1857,1858,"Manchester;Ainsworth; (etc., etc.);(1857-58)",1857-1858,,,Borders of Scotland|Scottish Borders (Scotland),,,14228408.0,enk,7693881,1,5.0,2.0,v.1,1.0,"Wilson's tales of the borders, and of Scotland;",,True,"Wilson's tales of the borders, and of Scotland;",0.2039393544579188,0.01020724784732,John,m,14.745644599303136,30.03634862630359,39.34375,26.14919704861111,387.96875,3693.939995659722,2.3,['fiction'],['unknown'],"wilson's tales of the borders, and of scotland;  wilson's tales of the borders, and of scotland;",False,True
mdp.39015058691265,,,,1858.0,1858.0,m,1858,1880,Edinburgh;London;W. Blackwood and sons;1858-1880,1858-1880,"joint-stock company (limited). Walford, L.B. Bee or Beatrix. The night-wanderer of an Afghaun fort. Macleod, N. Ayrshire curling song. Hamley, C. The light on the hearth. How to boil peas. Keene, H.G. Clive's dream before the battle of Plassey.--v.6. Lever, C. What I did at Belgrade. Shand, A.I. Wrecked off the Riff coast. Dollie, and the two Smiths. Majendie, Margaret, lady. A railway journey. Francillon, R.E. A dog without a tail. Hamley, C. Wassail.|v.1. The tender recollections of Irene Mac",,,,PZ1.B57A,37193215.0,stk,203870,1,1.0,1.0,v.1,1.0,"Tales from ""Blackwood."" | New series.",,True,"Tales from ""Blackwood."" New series",0.1813638810172897,0.1016534266007077,,unknown,13.791979949874689,30.32514871137744,27.87560975609756,22.104039262343846,276.79024390243904,3014.229173111243,0.7,['fiction'],['fiction and juvenile belles lettres'],"tales from ""blackwood."" | new series.  tales from ""blackwood."" new series",False,True
mdp.39015058691315,,,,1858.0,1858.0,m,1858,1880,Edinburgh;London;W. Blackwood and sons;1858-1880,1858-1880,"joint-stock company (limited). Walford, L.B. Bee or Beatrix. The night-wanderer of an Afghaun fort. Macleod, N. Ayrshire curling song. Hamley, C. The light on the hearth. How to boil peas. Keene, H.G. Clive's dream before the battle of Plassey.--v.6. Lever, C. What I did at Belgrade. Shand, A.I. Wrecked off the Riff coast. Dollie, and the two Smiths. Majendie, Margaret, lady. A railway journey. Francillon, R.E. A dog without a tail. Hamley, C. Wassail.|v.1. The tender recollections of Irene Mac",,,,PZ1.B57A,37193215.0,stk,203870,1,1.0,1.0,v.6,6.0,"Tales from ""Blackwood."" | New series.",The tender recollections of Irene Mac,True,The tender recollections of Irene Mac,0.2150619775737624,0.028170631449255,,unknown,11.94535519125683,15.696467496789989,27.9142091152815,20.70577665332173,278.1340482573726,3089.864068598208,1.4,['fiction'],['fiction and juvenile belles lettres'],"tales from ""blackwood."" | new series. the tender recollections of irene mac the tender recollections of irene mac",False,True
uc2.ark+=13960=t6445pm85,"Gatty, Alfred","Gatty, Alfred, Mrs",1809-1873.,1858.0,1858.0,s,1858,    ,London;Bell and Daldy;1858.,1858,,,,,,3078590.0,enk,326080,2,2.0,2.0,,,Legendary tales,,True,Legendary tales,0.1105038195445215,0.0258684875195161,Alfred,m,8.750819672131147,14.423155065842517,27.906451612903226,21.710603537981275,207.4935483870968,2033.178990634756,1.5,['unknown'],['unknown'],legendary tales  legendary tales,False,True
njp.32101076207669,,,,1858.0,1858.0,m,1858,1880,Edinburgh;Blackwood and Sons;1858-1880?,1858-1880,,,Short stories,,,37193215.0,stk,9029509,1,1.0,1.0,vol.2,2.0,"Tales from ""Blackwood "" : | New series.",,True,"Tales from ""Blackwood "" : New series",0.1904927147189832,0.0330711764826972,,unknown,13.3425,25.185193750000003,28.261728395061727,12.578411827465327,281.3703703703704,1931.6455418381345,2.5,['fiction'],['unknown'],"tales from ""blackwood "" : | new series.  tales from ""blackwood "" : new series",False,True
inu.39000005818161,"Asbjørnsen, Peter Christen","Asbjørnsen, Peter Christen",1812-1885.,1859.0,1859.0,s,1859,    ,Edinburgh;Edmonston and Douglas;1859.,1859,"2d. ed., enl.",,"Folklore|Folklore, Norway|Fairy tales|Norway",,PZ8.A89Po3,11008402.0,stk,6935348,1,6.0,4.0,,,"Popular tales from the Norse, | $c: by George Webbe Dasent, O. C. L.; with and introductory essay on the origin and diffusion of popular tales.",,True,Popular tales from the Norse,0.3163934512588222,0.5261009630607957,Peter,m,11.762762762762764,15.529304078853627,27.566318926974663,19.381220279805703,317.2354694485842,3032.150217328053,1.9,['unknown'],['fiction and juvenile belles lettres'],"popular tales from the norse, | $c: by george webbe dasent, o. c. l.; with and introductory essay on the origin and diffusion of popular tales.  popular tales from the norse",False,True
nnc1.0046234080,,,,1859.0,1859.0,s,1859,    ,London;Printed by T. Richards;1859.,1859,,,,,,16217742.0,enk,8400452,1,1.0,1.0,,,"The Tincker of Turvey, or, Canterbury tales : | an early collection of English novels / | $c: edited by James O. Halliwell.",,True,"The Tincker of Turvey, or, Canterbury tales : an early collection of English novels",0.6962590311983012,0.86406661493869,,unknown,8.525862068965518,18.23208977407848,26.427350427350422,23.560961355833143,278.05128205128204,5561.672583826432,2.5,['unknown'],['unknown'],"the tincker of turvey, or, canterbury tales : | an early collection of english novels / | $c: edited by james o. halliwell.  the tincker of turvey, or, canterbury tales : an early collection of english novels",False,True
njp.32101063693673,"Paget, Francis Edward","Paget, Francis Edward",1806-1882.,1859.0,1859.0,s,1859,    ,London;J. Masters;1859.,1859,,,,,,22105342.0,enk,8917556,1,1.0,1.0,,,"The curate of Cumberworth ; and The vicar of Roost : | tales / | $c: by the Author of ""The owlet of Owlstone Edge,"" ""S. Antholin's,"" etc.",,True,The curate of Cumberworth ; and The vicar of Roost : tales,0.3954065825079095,0.0241755401299709,Francis,m,13.466517857142858,131.82030751753825,28.73555555555556,38.12784691358025,274.6088888888889,5910.429254320989,3.1,['fiction'],['unknown'],"the curate of cumberworth ; and the vicar of roost : | tales / | $c: by the author of ""the owlet of owlstone edge,"" ""s. antholin's,"" etc.  the curate of cumberworth ; and the vicar of roost : tales",False,True
uc2.ark+=13960=t8ff3rg9c,"Gogol?_, Nikola?_ Vasil?_evich","Gogol?_, Nikola?_ Vasil?_evich",,1860.0,1860.0,s,1860,    ,London;J. Blackwood;1860,1860,,,,,,10862120.0,enk,6545481,2,2.0,2.0,,,Cossack tales,,True,Cossack tales,0.0728380359415592,0.0090541690085161,Nikola,m,15.333333333333334,35.4702842377261,40.53256704980843,31.96541448305222,333.9348659003832,3038.4746847521324,2.5,['unknown'],['unknown'],cossack tales  cossack tales,False,True
nnc1.0059607254,,,,1860.0,1860.0,s,1860,    ,London;W.H. Allen & Co.;1860,1860,"Fourth edition,|carefully corrected, and collated with original mss. having the essential vowel points and punctuation marked throughout. To which is added, a vocabulary of all the words occurring in the work. By Duncan Forbes ...",,Hindustani literature,,,41313326.0,enk,8400706,1,1.0,1.0,,,"Bāgh o Bahār; | consisting of entertaining tales in the Hindūstānī language, | $c: by Mīr Amman of Dihlī ...",,True,Bāgh o Bahār; consisting of entertaining tales in the Hindūstānī language,0.9754438752774448,0.2019880067960711,,unknown,39.75,283.64204545454544,31.05985037406484,1105.612378032475,325.57605985037407,115404.8227685151,1.3,['fiction'],['unknown'],"bāgh o bahār; | consisting of entertaining tales in the hindūstānī language, | $c: by mīr amman of dihlī ...  bāgh o bahār; consisting of entertaining tales in the hindūstānī language",False,True
nyp.33433075746705,"Hodges, R","Hodges, R",,1860.0,1860.0,s,1860,    ,London;B.M. Pickering;1860.,1860,The settler in South Africa.--Lucy Leeson.--The Cape Indian.--The emigrant girl.--The prize Negress.--Going on togt.,,Blacks|Cape of Good Hope|South Africa,Cape of Good Hope (South Africa),,25527149.0,enk,8584596,1,1.0,1.0,,,The settler in South Africa and other tales.,,True,The settler in South Africa and other tales,0.3953803909303888,0.0434266712739831,R,unknown,9.13076923076923,16.590591715976327,28.68840579710145,51.794213400546106,285.89130434782606,6711.038909892879,0.6,['fiction'],['unknown'],the settler in south africa and other tales.  the settler in south africa and other tales,False,True
nyp.33433074916317,,,,1860.0,1860.0,s,1860,    ,London;R. Bentley;1860.,1860,,,,,,37193187.0,enk,8666928,1,1.0,1.0,v. 1-3,1.0,"Tales from ""Bentley"" ...",,True,"Tales from ""Bentley""",0.2904959441623044,0.1722973632833545,,unknown,11.063943161634104,21.75790061488663,28.197879858657245,17.646355929028957,276.45583038869256,2442.4211939217616,2.4,['unknown'],['unknown'],"tales from ""bentley"" ...  tales from ""bentley""",False,True
nyp.33433073356564,"Gogolʹ, Nikolaĭ Vasilʹevich","Gogolʹ, Nikolaĭ Vasilʹevich",1809-1852.,1860.0,1852.0,s,1860,    ,London;Blackwood;1860].,1860,,,Folklore|Ukraine|Tales,,,,enk,8699112,1,1.0,1.0,,,Cossack tales / | $c: by Nicholas Gogol...,,True,Cossack tales,0.0976510476239847,0.0077672763142491,Nikola,m,16.90262172284644,96.08789574829215,35.77490774907749,44.94933347857464,341.1291512915129,5344.07557086641,2.7,['fiction'],['unknown'],cossack tales / | $c: by nicholas gogol...  cossack tales,False,True
njp.32101068970662,"Kavanagh, Julia","Kavanagh, Julia",1824-1877.,1860.0,1860.0,s,1860,    ,London;Hurst and Blackett;1860.,1860,,,,,PZ3.K172S,21369528.0,enk,8723199,2,3.0,3.0,vol.1,1.0,"Seven years, and other tales / | $c: by Julia Kavanagh.",,True,"Seven years, and other tales",0.0421564953769365,0.1653686047777856,Julia,f,10.628398791540786,12.22142915818585,24.973372781065088,27.98449809180351,220.03254437869825,2801.143911277616,0.8,['fiction'],['fiction and juvenile belles lettres'],"seven years, and other tales / | $c: by julia kavanagh.  seven years, and other tales",False,True
nyp.33433075743884,"Mrs. Sherwood, (Mary Martha)","Sherwood, (Mary Martha), 1775-1851, Mrs",1775-1851.,1861.0,1851.0,s,1861,    ,London;S. Marshall;1861,1861,,,,,,37296124.0,enk,8670152,1,1.0,1.0,,,Popular tales.,,True,Popular tales,0.2013776615129434,0.3319611414239423,Mary,f,11.74736842105263,19.16775623268698,36.91666666666666,33.53993055555555,448.3723958333333,6613.192050509984,1.9,['fiction'],['unknown'],popular tales.  popular tales,False,True
uiuo.ark+=13960=t1dj63c2q,,,,1861.0,1861.0,s,1861,    ,London;J. Hogg and Sons;1861,1861,,,,,PZ1.T921,11864905.0,enk,8723939,1,1.0,1.0,v.1,1.0,The Twickenham tales,,True,The Twickenham tales,0.4162257461556705,0.0156277896066583,,unknown,12.731778425655977,37.63068109376196,34.286532951289395,48.07262666152166,298.54154727793696,4148.322772391031,2.1,['fiction'],['fiction and juvenile belles lettres'],the twickenham tales  the twickenham tales,False,True
uc2.ark+=13960=t21c1vd0j,,,,1861.0,1861.0,s,1861,    ,Edinburgh;Gall & Inglis;1861,1861,,,Fairy tales,,,14522197.0,stk,9360515,1,1.0,1.0,,,Favourite fairy tales,,True,Favourite fairy tales,0.2422879154624909,0.9958337317579604,,unknown,6.152542372881356,4.287465287752561,26.25543478260869,43.87497046313799,198.95652173913044,3359.356805293006,2.5,"['fiction', 'urn:uuid:f40f6d63-6ee1-4eb4-a291-251f330937d8']",['unknown'],favourite fairy tales  favourite fairy tales,False,True
uc2.ark+=13960=t5k932k04,"Reeve, Wybert","Reeve, Wybert",,1862.0,1862.0, ,1862,    ,Sheffield;Pawson and Brailsford;1862.,1862,,,,,,82479911.0,enk,7670895,1,1.0,1.0,,,"Romance of reality, or, Tales from a wanderer's diary",,True,"Romance of reality, or, Tales from a wanderer's diary",0.387417183863596,0.0119065893125094,Wybert,unknown,10.259803921568627,18.68250192233756,31.27884615384616,34.17224482248521,264.6394230769231,3248.394022744083,2.5,['unknown'],['unknown'],"romance of reality, or, tales from a wanderer's diary  romance of reality, or, tales from a wanderer's diary",False,True
nyp.33433081894481,,,,1862.0,1862.0,s,1862,    ,London;W.H. Allen;1862.,1862,"4. ed.,|carefully corr., and collated with original mss., having the essential vowel points and punctuation marked throughout. To which is added a vocabulary of all the words occurring in the work, by Duncan Forbes.",,Hindustani literature,,,41313712.0,enk,8694018,1,1.0,1.0,,,Bāgh o bahār; | $c: consisting of entertaining tales in the Hindūstānī language [translated] by Mīr Amman of Dihlī.,,True,Bāgh o bahār;,0.7118186602703455,0.0806835697322546,,unknown,20.65038560411311,290.21196000555113,42.28463476070529,747.2917790227715,521.1108312342569,94125.74086505212,0.0,['fiction'],['unknown'],bāgh o bahār; | $c: consisting of entertaining tales in the hindūstānī language [translated] by mīr amman of dihlī.  bāgh o bahār;,False,True
uc1.$b266935,"Edgeworth, Maria","Edgeworth, Maria",1767-1849.,1863.0,1849.0,s,1863,    ,"London;New York;Routledge, Warne, & Routledge;1863.",1863,,,,,,28492353.0,enk,6513063,1,1.0,1.0,,,Moral tales for young people,,True,Moral tales for young people,0.1415329436046726,0.9041963806551688,Maria,f,19.13394919168591,62.46242712905824,43.188208616780045,60.1028995120346,494.0362811791383,10059.08711905019,2.3,['unknown'],['unknown'],moral tales for young people  moral tales for young people,False,True
njp.32101019347416,,,,1863.0,1863.0,s,1863,    ,London;Ward and Lock;1863.,1863,"Brothers in arms -- One of three -- Kate's soldier -- An arm for a heart -- Helen Christian -- The narrow escape -- Mizpah -- The yellow jasmine -- The drummer of the Illinois XX-th -- Always faithful -- May flowers -- Outwitted -- Adventures of a teacher in Dixie -- The tuberose -- Love and duty -- Red, white, and blue -- Strategy -- In the hospital -- Trapped -- Tangled and ravelled -- Wounded -- The soldier in love -- John Morgan's substitute -- A military tableau.",,"History|Civil War, 1861-1865",United States,,22745413.0,enk,8885697,1,1.0,1.0,,,"The American mail-bag, or Tales of the War / | $c: never before published.",,True,"The American mail-bag, or Tales of the War",0.0384378155897031,0.0528708510801223,,unknown,17.23209169054441,28.22980106895674,32.38418079096045,31.665964441890896,334.2768361581921,4390.397938012704,1.8,['fiction'],['unknown'],"the american mail-bag, or tales of the war / | $c: never before published.  the american mail-bag, or tales of the war",False,True
mdp.39015028769803,,,,1864.0,1864.0,s,1864,    ,London;Willis & Sotheran;1864.,1864,"--v.1. A hundred mery talys, from the only known copy. Mery tales and quicke answeres, from the rare edition of 1567.--v.2. Merie tales of Skelton. Jests of Scogin. Sackfull of newes. Tarleton's jests. Merrie conceited jests of George Peele. Jacke of Dover.--v.3. Merie tales of the mad men of Gotham. XII mery jests of the Wydow Edyth. Pasquils jests with Mother Bunches merriments. The pleasant conceits of Old Hobson. Certayne conceyts and jeasts. Taylors wit and miarth. Conceits, clinches, flas",,"Sources|Jestbooks|1564-1616|Shakespeare, William",,PR2953W5H3,2827883.0,enk,1112148,2,2.0,2.0,v.2,2.0,"Shakespeare jest-books : | reprints of the early and very rare jest-books supposed to have been used by Shakespeare / | $c: edited, with introduction and notes, by W. Carew Hazlitt.",Merie tales of Skelton. Jests of Scogin. Sackfull of newes. Tarleton's jests. Merrie conceited jests of George Peele. Jacke of Dover,True,Merie tales of Skelton. Jests of Scogin. Sackfull of newes. Tarleton's jests. Merrie conceited jests of George Peele. Jacke of Dover,0.8741630979252369,0.98409657333904,,unknown,11.113513513513514,34.133060628195764,26.322666666666667,39.57855288888889,278.5466666666667,5485.282488888889,2.1,['unknown'],['english literature'],"shakespeare jest-books : | reprints of the early and very rare jest-books supposed to have been used by shakespeare / | $c: edited, with introduction and notes, by w. carew hazlitt. merie tales of skelton. jests of scogin. sackfull of newes. tarleton's jests. merrie conceited jests of george peele. jacke of dover merie tales of skelton. jests of scogin. sackfull of newes. tarleton's jests. merrie conceited jests of george peele. jacke of dover",False,True
uc2.ark+=13960=t2g73914b,,,,1864.0,1864.0,s,1864,    ,London;Willis & Sotheran;1864.,1864,,,"Sources|Jestbooks|1564-1616|Shakespeare, William",,PR2953W5H3,2827883.0,enk,1112148,2,2.0,2.0,v.3,3.0,Shakespeare jest-books,"Merie tales of the mad men of Gotham. XII mery jests of the Wydow Edyth. Pasquils jests with Mother Bunches merriments. The pleasant conceits of Old Hobson. Certayne conceyts and jeasts. Taylors wit and miarth. Conceits, clinches, flas",True,"Merie tales of the mad men of Gotham. XII mery jests of the Wydow Edyth. Pasquils jests with Mother Bunches merriments. The pleasant conceits of Old Hobson. Certayne conceyts and jeasts. Taylors wit and miarth. Conceits, clinches, flas",0.9582681885102968,0.9890741775012304,,unknown,10.076749435665914,28.084402977849567,32.75615212527964,102.60944201712634,247.22371364653245,5964.697155783772,2.4,['unknown'],['english literature'],"shakespeare jest-books merie tales of the mad men of gotham. xii mery jests of the wydow edyth. pasquils jests with mother bunches merriments. the pleasant conceits of old hobson. certayne conceyts and jeasts. taylors wit and miarth. conceits, clinches, flas merie tales of the mad men of gotham. xii mery jests of the wydow edyth. pasquils jests with mother bunches merriments. the pleasant conceits of old hobson. certayne conceyts and jeasts. taylors wit and miarth. conceits, clinches, flas",False,True
nyp.33433008143236,"Kirton, John William","Kirton, John William",1831-1892.,1864.0,1864.0,s,1864,    ,London;Jarrold & Sons;1864.,1864,2. ed.,,,,,38755205.0,enk,8597592,1,1.0,1.0,,,"Buy your own cherries, and other tales.",,True,"Buy your own cherries, and other tales",0.3933738681626469,0.2275508046429677,John,m,12.398550724637682,84.71796891409367,30.979310344827585,137.27543400713438,333.2068965517241,18570.95029726516,2.5,['unknown'],['unknown'],"buy your own cherries, and other tales.  buy your own cherries, and other tales",False,True
nyp.33433084128663,"Thornbury, Walter","Thornbury, Walter",1828-1876.,1865.0,1865.0,s,1865,    ,"London;S. Low, Son, and Marston;1865",1865,,,,,PZ3.T3932T,37302507.0,enk,8670081,1,1.0,1.0,v. 1,1.0,Tales for the marines. | $c: By Walter Thornbury ...,,True,Tales for the marines,0.2188974078549824,0.071313320040393,Walter,m,12.634969325153374,22.13362377206519,28.777439024390244,22.813271490184416,267.9817073170732,2642.7557629387265,2.1,['fiction'],['fiction and juvenile belles lettres'],tales for the marines. | $c: by walter thornbury ...  tales for the marines,False,True
nyp.33433066603881,"Adams, H. C. (Henry Cadwallader)","Adams, H. C. (Henry Cadwallader)",1817-1899.,1865.0,1865.0,t,1866,1865,London;1866 [1865,1866,,,"Children's stories, English",,,27009790.0,enk,8689034,1,1.0,1.0,,,"Balderscourt; | or, holiday tales.",,True,"Balderscourt; or, holiday tales",0.2280626983635218,0.9021519346654514,Henry,m,12.5,37.19818652849741,25.8675,35.209943749999994,256.8825,4062.19869375,1.2,['unknown'],['unknown'],"balderscourt; | or, holiday tales.  balderscourt; or, holiday tales",False,True
